A1: Número | B1: Nome | C1: Teste | E1: Trabalho | F1: Nt. Final
A2: 21019 | B2: Adriano Simões Mariano | C2: 4.5 | D2: =IF(C2<7.5,"Exame","") -> Exame | E2: 15.5 | F2: =ROUND(C2*0.7+E2*0.3,0) -> 8 | G2: =IF(F2<9.5,"Exame","Aprovado") -> Exame
A3: 21051 | B3: Ana Eusébio Patriarca | C3: 3 | D3: =IF(C3<7.5,"Exame","") -> Exame | E3: 11.5 | F3: =ROUND(C3*0.7+E3*0.3,0) -> 6 | G3: =IF(F3<9.5,"Exame","Aprovado") -> Exame
A4: 20120 | B4: Ana Pereira Silva | C4: 2 | D4: =IF(C4<7.5,"Exame","") -> Exame | E4: 16 | F4: =ROUND(C4*0.7+E4*0.3,0) -> 6 | G4: =IF(F4<9.5,"Exame","Aprovado") -> Exame
A5: 21071 | B5: André Silvestre Pescada | C5: 7 | D5: =IF(C5<7.5,"Exame","") -> Exame | E5: 14 | F5: =ROUND(C5*0.7+E5*0.3,0) -> 9 | G5: =IF(F5<9.5,"Exame","Aprovado") -> Exame
A6: 21027 | B6: António Catela Menezes | C6: 2 | D6: =IF(C6<7.5,"Exame","") -> Exame | F6: =ROUND(C6*0.7+E6*0.3,0) -> 1 | G6: =IF(F6<9.5,"Exame","Aprovado") -> Exame
A7: 21068 | B7: António Oliveira Fernandes | C7: 7 | D7: =IF(C7<7.5,"Exame","") -> Exame | E7: 11.5 | F7: =ROUND(C7*0.7+E7*0.3,0) -> 8 | G7: =IF(F7<9.5,"Exame","Aprovado") -> Exame
A8: 21061 | B8: António Vidigal Costa | C8: 8.5 | D8: =IF(C8<7.5,"Exame","") ->  | E8: 12 | F8: =ROUND(C8*0.7+E8*0.3,0) -> 10 | G8: =IF(F8<9.5,"Exame","Aprovado") -> Aprovado
A9: 21006 | B9: Henrique Freilão Arraiolos | C9: 9.5 | D9: =IF(C9<7.5,"Exame","") ->  | E9: 16 | F9: =ROUND(C9*0.7+E9*0.3,0) -> 11 | G9: =IF(F9<9.5,"Exame","Aprovado") -> Aprovado
A10: 21082 | B10: Joana Pereira Santos | C10: 2 | D10: =IF(C10<7.5,"Exame","") -> Exame | F10: =ROUND(C10*0.7+E10*0.3,0) -> 1 | G10: =IF(F10<9.5,"Exame","Aprovado") -> Exame
A11: 21039 | B11: Liliana Jesus Pimenta | C11: 8.65 | D11: =IF(C11<7.5,"Exame","") ->  | E11: 11.5 | F11: =ROUND(C11*0.7+E11*0.3,0) -> 10 | G11: =IF(F11<9.5,"Exame","Aprovado") -> Aprovado
A12: 21026 | B12: Miguel Ferrão Lourenço | C12: 7 | D12: =IF(C12<7.5,"Exame","") -> Exame | E12: 12 | F12: =ROUND(C12*0.7+E12*0.3,0) -> 9 | G12: =IF(F12<9.5,"Exame","Aprovado") -> Exame
A13: 21056 | B13: Nuno Brigas Santos | C13: 14 | D13: =IF(C13<7.5,"Exame","") ->  | E13: 16 | F13: =ROUND(C13*0.7+E13*0.3,0) -> 15 | G13: =IF(F13<9.5,"Exame","Aprovado") -> Aprovado
A14: 21083 | B14: Patricio Cruz Simões | C14: 6.97 | D14: =IF(C14<7.5,"Exame","") -> Exame | F14: =ROUND(C14*0.7+E14*0.3,0) -> 5 | G14: =IF(F14<9.5,"Exame","Aprovado") -> Exame
A15: 21044 | B15: Pedro Marques Ribeiro | C15: 2 | D15: =IF(C15<7.5,"Exame","") -> Exame | E15: 12 | F15: =ROUND(C15*0.7+E15*0.3,0) -> 5 | G15: =IF(F15<9.5,"Exame","Aprovado") -> Exame
A16: 21020 | B16: Tiago Fernandes Madeira | C16: 8 | D16: =IF(C16<7.5,"Exame","") ->  | E16: 15.5 | F16: =ROUND(C16*0.7+E16*0.3,0) -> 10 | G16: =IF(F16<9.5,"Exame","Aprovado") -> Aprovado