A1: Número | B1: Nome | C1: Teste | E1: Trabalho | F1: Nt. Final
A2: 21008 | B2: André Filipe Cunha Gouveia | C2: 8.5 | D2: =IF(C2<7.5,"Exame","") ->  | E2: 14 | F2: =ROUND(C2*0.7+E2*0.3,0) -> 10 | G2: =IF(F2<9.5,"Exame","Aprovado") -> Aprovado
A3: 21075 | B3: André Teixeira Sapata | C3: 14.66 | D3: =IF(C3<7.5,"Exame","") ->  | E3: 15 | F3: =ROUND(C3*0.7+E3*0.3,0) -> 15 | G3: =IF(F3<9.5,"Exame","Aprovado") -> Aprovado
A4: 21074 | B4: Bruno Miguel Xavier Martins | C4: 11 | D4: =IF(C4<7.5,"Exame","") ->  | E4: 15 | F4: =ROUND(C4*0.7+E4*0.3,0) -> 12 | G4: =IF(F4<9.5,"Exame","Aprovado") -> Aprovado
A5: 21014 | B5: Cláudio Melanda Nuno | C5: 10.16 | D5: =IF(C5<7.5,"Exame","") ->  | E5: 14 | F5: =ROUND(C5*0.7+E5*0.3,0) -> 11 | G5: =IF(F5<9.5,"Exame","Aprovado") -> Aprovado
A6: 21013 | B6: David José Santos Pereira | C6: 12 | D6: =IF(C6<7.5,"Exame","") ->  | E6: =12 -> 12 | F6: =ROUND(C6*0.7+E6*0.3,0) -> 12 | G6: =IF(F6<9.5,"Exame","Aprovado") -> Aprovado
A7: 21032 | B7: Diogo Francisco Fartaria | C7: 9.66 | D7: =IF(C7<7.5,"Exame","") ->  | E7: 12 | F7: =ROUND(C7*0.7+E7*0.3,0) -> 10 | G7: =IF(F7<9.5,"Exame","Aprovado") -> Aprovado
A8: 21021 | B8: Fernando Miguel Pires Viana | C8: 12 | D8: =IF(C8<7.5,"Exame","") ->  | E8: 12 | F8: =ROUND(C8*0.7+E8*0.3,0) -> 12 | G8: =IF(F8<9.5,"Exame","Aprovado") -> Aprovado
A9: 20128 | B9: Francisco Santos Andrade | C9: 10 | D9: =IF(C9<7.5,"Exame","") ->  | E9: 14.5 | F9: =ROUND(C9*0.7+E9*0.3,0) -> 11 | G9: =IF(F9<9.5,"Exame","Aprovado") -> Aprovado
A10: 21031 | B10: Frederico Figueiredo Santos | C10: 8.5 | D10: =IF(C10<7.5,"Exame","") ->  | E10: 14.5 | F10: =ROUND(C10*0.7+E10*0.3,0) -> 10 | G10: =IF(F10<9.5,"Exame","Aprovado") -> Aprovado
A11: 21086 | B11: Hugo Paulo Pereira Silva Nunes | C11: 10.5 | D11: =IF(C11<7.5,"Exame","") ->  | E11: 12 | F11: =ROUND(C11*0.7+E11*0.3,0) -> 11 | G11: =IF(F11<9.5,"Exame","Aprovado") -> Aprovado
A12: 99041 | B12: José Fernando Simões Gouveia | C12: 13.32 | D12: =IF(C12<7.5,"Exame","") ->  | E12: 10 | F12: =ROUND(C12*0.7+E12*0.3,0) -> 12 | G12: =IF(F12<9.5,"Exame","Aprovado") -> Aprovado
A13: 21111 | B13: Leandro Manuel Oliveira Cunha | C13: 6.6669999999999998 | D13: =IF(C13<7.5,"Exame","") -> Exame | E13: 10 | F13: =ROUND(C13*0.7+E13*0.3,0) -> 8 | G13: =IF(F13<9.5,"Exame","Aprovado") -> Exame
A14: 21089 | B14: Marco Paulo Clamote Capela | C14: 11.16 | D14: =IF(C14<7.5,"Exame","") ->  | E14: 13 | F14: =ROUND(C14*0.7+E14*0.3,0) -> 12 | G14: =IF(F14<9.5,"Exame","Aprovado") -> Aprovado
A15: 21004 | B15: Mauro Santos Pulquério | C15: 13.66 | D15: =IF(C15<7.5,"Exame","") ->  | E15: 14.5 | F15: =ROUND(C15*0.7+E15*0.3,0) -> 14 | G15: =IF(F15<9.5,"Exame","Aprovado") -> Aprovado
A16: 21015 | B16: Nuno Filipe Pereira da Silva | C16: 5.75 | D16: =IF(C16<7.5,"Exame","") -> Exame | E16: 14.5 | F16: =ROUND(C16*0.7+E16*0.3,0) -> 8 | G16: =IF(F16<9.5,"Exame","Aprovado") -> Exame
A17: 21095 | B17: Paulo Jorge Oliveira Morais | C17: 11.5 | D17: =IF(C17<7.5,"Exame","") ->  | E17: 14 | F17: =ROUND(C17*0.7+E17*0.3,0) -> 12 | G17: =IF(F17<9.5,"Exame","Aprovado") -> Aprovado
A18: 21067 | B18: Ricardo Pereira Dinonisio | C18: 12.25 | D18: =IF(C18<7.5,"Exame","") ->  | E18: 10 | F18: =ROUND(C18*0.7+E18*0.3,0) -> 12 | G18: =IF(F18<9.5,"Exame","Aprovado") -> Aprovado
A19: 21010 | B19: Ricardo Santos Ferreira | C19: 11.5 | D19: =IF(C19<7.5,"Exame","") ->  | E19: 13 | F19: =ROUND(C19*0.7+E19*0.3,0) -> 12 | G19: =IF(F19<9.5,"Exame","Aprovado") -> Aprovado
A20: 20073 | B20: Rui Castanheira Castro | C20: 8.5 | D20: =IF(C20<7.5,"Exame","") ->  | E20: 15 | F20: =ROUND(C20*0.7+E20*0.3,0) -> 10 | G20: =IF(F20<9.5,"Exame","Aprovado") -> Aprovado
A21: 21001 | B21: Rui Manuel Lopes Lageira | C21: 17 | D21: =IF(C21<7.5,"Exame","") ->  | E21: 14.5 | F21: =ROUND(C21*0.7+E21*0.3,0) -> 16 | G21: =IF(F21<9.5,"Exame","Aprovado") -> Aprovado
A22: 21057 | B22: Tiago Bruno Lopes Martins | C22: 11.4 | D22: =IF(C22<7.5,"Exame","") ->  | E22: 12 | F22: =ROUND(C22*0.7+E22*0.3,0) -> 12 | G22: =IF(F22<9.5,"Exame","Aprovado") -> Aprovado
A23: 21029 | B23: Tiago José Ribeiro Deus | C23: 12.5 | D23: =IF(C23<7.5,"Exame","") ->  | E23: =E19 -> 13 | F23: =ROUND(C23*0.7+E23*0.3,0) -> 13 | G23: =IF(F23<9.5,"Exame","Aprovado") -> Aprovado