A1: Número | B1: Nome | C1: Teste | E1: Trabalho | F1: Nt. Final
A2: 21091 | B2: Ana Margarida Dolores | C2: 10.75 | D2: =IF(C2<7.5,"Exame","") ->  | E2: 14.5 | F2: =ROUND(C2*0.7+E2*0.3,0) -> 12 | G2: =IF(F2<9.5,"Exame","Aprovado") -> Aprovado
A3: 21081 | B3: Ana Margarida Gama | C3: 12.16 | D3: =IF(C3<7.5,"Exame","") ->  | E3: 13.5 | F3: =ROUND(C3*0.7+E3*0.3,0) -> 13 | G3: =IF(F3<9.5,"Exame","Aprovado") -> Aprovado
A4: 21087 | B4: André Gonçalves Oliveira | C4: 9.5 | D4: =IF(C4<7.5,"Exame","") ->  | E4: 13.5 | F4: =ROUND(C4*0.7+E4*0.3,0) -> 11 | G4: =IF(F4<9.5,"Exame","Aprovado") -> Aprovado
A5: 21088 | B5: Angela Ferreira Matos | C5: 9.25 | D5: =IF(C5<7.5,"Exame","") ->  | E5: 14.5 | F5: =ROUND(C5*0.7+E5*0.3,0) -> 11 | G5: =IF(F5<9.5,"Exame","Aprovado") -> Aprovado
A6: 21099 | B6: Bruno Gonçalo Santos | C6: 10 | D6: =IF(C6<7.5,"Exame","") ->  | E6: 14 | F6: =ROUND(C6*0.7+E6*0.3,0) -> 11 | G6: =IF(F6<9.5,"Exame","Aprovado") -> Aprovado
A7: 21067 | B7: César Pedro Oliveira | C7: 3.82 | D7: =IF(C7<7.5,"Exame","") -> Exame | F7: =ROUND(C7*0.7+E7*0.3,0) -> 3 | G7: =IF(F7<9.5,"Exame","Aprovado") -> Exame
A8: 20092 | B8: Gonçalo Pedro Lucas Silva | C8: 11.25 | D8: =IF(C8<7.5,"Exame","") ->  | F8: =ROUND(C8*0.7+E8*0.3,0) -> 8 | G8: =IF(F8<9.5,"Exame","Aprovado") -> Exame
A9: 21042 | B9: Marco Paulo Gomes Melo | C9: 11.16 | D9: =IF(C9<7.5,"Exame","") ->  | E9: 10 | F9: =ROUND(C9*0.7+E9*0.3,0) -> 11 | G9: =IF(F9<9.5,"Exame","Aprovado") -> Aprovado
A10: 21018 | B10: Miguel Áspera Furtado | C10: 11.82 | D10: =IF(C10<7.5,"Exame","") ->  | E10: 13.5 | F10: =ROUND(C10*0.7+E10*0.3,0) -> 12 | G10: =IF(F10<9.5,"Exame","Aprovado") -> Aprovado
A11: 21113 | B11: Nuno Sampaio | C11: 11 | D11: =IF(C11<7.5,"Exame","") ->  | E11: 14.5 | F11: =ROUND(C11*0.7+E11*0.3,0) -> 12 | G11: =IF(F11<9.5,"Exame","Aprovado") -> Aprovado
A12: 21096 | B12: Pedro Pereira Pinto | C12: 13.5 | D12: =IF(C12<7.5,"Exame","") ->  | E12: 14 | F12: =ROUND(C12*0.7+E12*0.3,0) -> 14 | G12: =IF(F12<9.5,"Exame","Aprovado") -> Aprovado
A13: 21100 | B13: Rui Miguel Melo | C13: 12.5 | D13: =IF(C13<7.5,"Exame","") ->  | F13: =ROUND(C13*0.7+E13*0.3,0) -> 9 | G13: =IF(F13<9.5,"Exame","Aprovado") -> Exame
A14: 21101 | B14: Simão Carvalho David | C14: 6 | D14: =IF(C14<7.5,"Exame","") -> Exame | F14: =ROUND(C14*0.7+E14*0.3,0) -> 4 | G14: =IF(F14<9.5,"Exame","Aprovado") -> Exame