A1: Número | B1: Nome | C1: Teste | E1: Trabalho | F1: Nt. Final
A2: 21078 | B2: Alexandra Gabriela de Sousa | C2: 10.5 | D2: =IF(C2<7.5,"Exame","") ->  | E2: 14 | F2: =ROUND(C2*0.7+E2*0.3,0) -> 12 | G2: =IF(F2<9.5,"Exame","Aprovado") -> Aprovado
A3: 21097 | B3: Ana Carmo Amâncio | C3: 9.58 | D3: =IF(C3<7.5,"Exame","") ->  | E3: 13 | F3: =ROUND(C3*0.7+E3*0.3,0) -> 11 | G3: =IF(F3<9.5,"Exame","Aprovado") -> Aprovado
A4: 21030 | B4: André Francisco Morgado Duarte | C4: 12.41 | D4: =IF(C4<7.5,"Exame","") ->  | E4: 10 | F4: =ROUND(C4*0.7+E4*0.3,0) -> 12 | G4: =IF(F4<9.5,"Exame","Aprovado") -> Aprovado
A5: 21023 | B5: Bruno Renato Veloso | C5: 4.66 | D5: =IF(C5<7.5,"Exame","") -> Exame | E5: 12 | F5: =ROUND(C5*0.7+E5*0.3,0) -> 7 | G5: =IF(F5<9.5,"Exame","Aprovado") -> Exame
A6: 21066 | B6: Carlos Tiago Nuno Dionisio | C6: 2 | D6: =IF(C6<7.5,"Exame","") -> Exame | F6: =ROUND(C6*0.7+E6*0.3,0) -> 1 | G6: =IF(F6<9.5,"Exame","Aprovado") -> Exame
A7: 21052 | B7: Claudio Natércio Barreto | C7: 8 | D7: =IF(C7<7.5,"Exame","") ->  | F7: =ROUND(C7*0.7+E7*0.3,0) -> 6 | G7: =IF(F7<9.5,"Exame","Aprovado") -> Exame
A8: 21090 | B8: Daniel Monteiro Patricio | C8: 9.52 | D8: =IF(C8<7.5,"Exame","") ->  | E8: 16 | F8: =ROUND(C8*0.7+E8*0.3,0) -> 11 | G8: =IF(F8<9.5,"Exame","Aprovado") -> Aprovado
A9: 21003 | B9: Fernando Ferreira Braz | C9: 11 | D9: =IF(C9<7.5,"Exame","") ->  | E9: 16 | F9: =ROUND(C9*0.7+E9*0.3,0) -> 13 | G9: =IF(F9<9.5,"Exame","Aprovado") -> Aprovado
A10: 21108 | B10: Helder Fonseca Pais Silva | C10: 6.66 | D10: =IF(C10<7.5,"Exame","") -> Exame | E10: 8 | F10: =ROUND(C10*0.7+E10*0.3,0) -> 7 | G10: =IF(F10<9.5,"Exame","Aprovado") -> Exame
A11: 21050 | B11: Joni Leandro Vilela | C11: 7.66 | D11: =IF(C11<7.5,"Exame","") ->  | E11: 16 | F11: =ROUND(C11*0.7+E11*0.3,0) -> 10 | G11: =IF(F11<9.5,"Exame","Aprovado") -> Aprovado
A12: 21043 | B12: José Gabriel La-Salette Fulgêncio | C12: 4.75 | D12: =IF(C12<7.5,"Exame","") -> Exame | E12: 8 | F12: =ROUND(C12*0.7+E12*0.3,0) -> 6 | G12: =IF(F12<9.5,"Exame","Aprovado") -> Exame
A13: 21065 | B13: José Rafael Bernardo | C13: 5.5 | D13: =IF(C13<7.5,"Exame","") -> Exame | E13: 14 | F13: =ROUND(C13*0.7+E13*0.3,0) -> 8 | G13: =IF(F13<9.5,"Exame","Aprovado") -> Exame
A14: 21016 | B14: Júlio Cesar Ameixa Amândio | C14: 4.48 | D14: =IF(C14<7.5,"Exame","") -> Exame | E14: 14 | F14: =ROUND(C14*0.7+E14*0.3,0) -> 7 | G14: =IF(F14<9.5,"Exame","Aprovado") -> Exame
A15: 21048 | B15: Madalena Santos Casaca | C15: 11 | D15: =IF(C15<7.5,"Exame","") ->  | E15: 14 | F15: =ROUND(C15*0.7+E15*0.3,0) -> 12 | G15: =IF(F15<9.5,"Exame","Aprovado") -> Aprovado
A16: 99088 | B16: Manuel António Azevedo | C16: 12.5 | D16: =IF(C16<7.5,"Exame","") ->  | E16: 16 | F16: =ROUND(C16*0.7+E16*0.3,0) -> 14 | G16: =IF(F16<9.5,"Exame","Aprovado") -> Aprovado
A17: 21094 | B17: Manuel Sá Rodrigues | C17: 10.16 | D17: =IF(C17<7.5,"Exame","") ->  | F17: =ROUND(C17*0.7+E17*0.3,0) -> 7 | G17: =IF(F17<9.5,"Exame","Aprovado") -> Exame
A18: 21098 | B18: Mariana Sofia Conceição Curado | C18: 10.91 | D18: =IF(C18<7.5,"Exame","") ->  | F18: =ROUND(C18*0.7+E18*0.3,0) -> 8 | G18: =IF(F18<9.5,"Exame","Aprovado") -> Exame
A19: 21024 | B19: Marta Fernandes Baleizão | C19: 7.5 | D19: =IF(C19<7.5,"Exame","") ->  | E19: 12 | F19: =ROUND(C19*0.7+E19*0.3,0) -> 9 | G19: =IF(F19<9.5,"Exame","Aprovado") -> Exame
A20: 21036 | B20: Marta Susana Antunes Sousa | C20: 8.83 | D20: =IF(C20<7.5,"Exame","") ->  | E20: 13 | F20: =ROUND(C20*0.7+E20*0.3,0) -> 10 | G20: =IF(F20<9.5,"Exame","Aprovado") -> Aprovado
A21: 21110 | B21: Pedro Miguel Inácio Rezendes | C21: 12 | D21: =IF(C21<7.5,"Exame","") ->  | E21: 16 | F21: =ROUND(C21*0.7+E21*0.3,0) -> 13 | G21: =IF(F21<9.5,"Exame","Aprovado") -> Aprovado
A22: 21085 | B22: Ricardo José Soares Pereira | C22: 9 | D22: =IF(C22<7.5,"Exame","") ->  | F22: =ROUND(C22*0.7+E22*0.3,0) -> 6 | G22: =IF(F22<9.5,"Exame","Aprovado") -> Exame
A23: 21034 | B23: Tania Soraia Leitão Mira | C23: 11.57 | D23: =IF(C23<7.5,"Exame","") ->  | E23: 16 | F23: =ROUND(C23*0.7+E23*0.3,0) -> 13 | G23: =IF(F23<9.5,"Exame","Aprovado") -> Aprovado
A24: 21041 | B24: Tiago Manuel Correia | C24: 5.16 | D24: =IF(C24<7.5,"Exame","") -> Exame | E24: 14 | F24: =ROUND(C24*0.7+E24*0.3,0) -> 8 | G24: =IF(F24<9.5,"Exame","Aprovado") -> Exame