A1: Número | B1: Nome | C1: Teste | E1: Trabalho | F1: Nt. Final
A2: 21028 | B2: Ana Augusta Machado Rocha | C2: 8 | D2: =IF(C2<7.5,"Exame","") ->  | E2: 13 | F2: =ROUND(C2*0.7+E2*0.3,0) -> 10 | G2: =IF(F2<9.5,"Exame","Aprovado") -> Aprovado
A3: 21077 | B3: Carla Sofia Cerqueira Gonçalves | C3: 7.5 | D3: =IF(C3<7.5,"Exame","") ->  | E3: 10 | F3: =ROUND(C3*0.7+E3*0.3,0) -> 8 | G3: =IF(F3<9.5,"Exame","Aprovado") -> Exame
A4: 21073 | B4: Isabel Vieira dos Santos | C4: 4 | D4: =IF(C4<7.5,"Exame","") -> Exame | E4: 14 | F4: =ROUND(C4*0.7+E4*0.3,0) -> 7 | G4: =IF(F4<9.5,"Exame","Aprovado") -> Exame
A5: 21040 | B5: Ivo Morais Roque | C5: 8.25 | D5: =IF(C5<7.5,"Exame","") ->  | E5: 13 | F5: =ROUND(C5*0.7+E5*0.3,0) -> 10 | G5: =IF(F5<9.5,"Exame","Aprovado") -> Aprovado
A6: 21092 | B6: João Paulo Correia | C6: 11.25 | D6: =IF(C6<7.5,"Exame","") ->  | F6: =ROUND(C6*0.7+E6*0.3,0) -> 8 | G6: =IF(F6<9.5,"Exame","Aprovado") -> Exame
A7: 21067 | B7: João Renato Paulo | C7: 9 | F7: =ROUND(C7*0.7+E7*0.3,0) -> 6 | G7: =IF(F7<9.5,"Exame","Aprovado") -> Exame
A8: 21084 | B8: José António Dias Pimentel Cota | C8: 2 | D8: =IF(C8<7.5,"Exame","") -> Exame | F8: =ROUND(C8*0.7+E8*0.3,0) -> 1 | G8: =IF(F8<9.5,"Exame","Aprovado") -> Exame
A9: 21037 | B9: Liliana Alegre Pereira | C9: 11.25 | D9: =IF(C9<7.5,"Exame","") ->  | E9: 14 | F9: =ROUND(C9*0.7+E9*0.3,0) -> 12 | G9: =IF(F9<9.5,"Exame","Aprovado") -> Aprovado
A10: 21038 | B10: Luís Marques dos Santos | C10: 5 | D10: =IF(C10<7.5,"Exame","") -> Exame | F10: =ROUND(C10*0.7+E10*0.3,0) -> 4 | G10: =IF(F10<9.5,"Exame","Aprovado") -> Exame
A11: 21105 | B11: Maria João Cordeiro Santana | C11: 7.5 | D11: =IF(C11<7.5,"Exame","") ->  | E11: 13 | F11: =ROUND(C11*0.7+E11*0.3,0) -> 9 | G11: =IF(F11<9.5,"Exame","Aprovado") -> Exame
A12: 21093 | B12: Rafael Agostinho Oliveira | C12: 8.5 | D12: =IF(C12<7.5,"Exame","") ->  | F12: =ROUND(C12*0.7+E12*0.3,0) -> 6 | G12: =IF(F12<9.5,"Exame","Aprovado") -> Exame
A13: 21072 | B13: Raquel Almeida Granjeia | C13: 5.25 | D13: =IF(C13<7.5,"Exame","") -> Exame | E13: 10 | F13: =ROUND(C13*0.7+E13*0.3,0) -> 7 | G13: =IF(F13<9.5,"Exame","Aprovado") -> Exame
A14: 21103 | B14: Susana Mendes Alves | C14: 5 | D14: =IF(C14<7.5,"Exame","") -> Exame | F14: =ROUND(C14*0.7+E14*0.3,0) -> 4 | G14: =IF(F14<9.5,"Exame","Aprovado") -> Exame
A15: 21009 | B15: Telmo Malheiro da Cunha Pinto | C15: 6 | D15: =IF(C15<7.5,"Exame","") -> Exame | F15: =ROUND(C15*0.7+E15*0.3,0) -> 4 | G15: =IF(F15<9.5,"Exame","Aprovado") -> Exame
A16: 21058 | B16: Tiago Guerreiro Fonseca | C16: 9.25 | D16: =IF(C16<7.5,"Exame","") ->  | E16: 14 | F16: =ROUND(C16*0.7+E16*0.3,0) -> 11 | G16: =IF(F16<9.5,"Exame","Aprovado") -> Aprovado
A17: 21063 | B17: Vitor Jorge Sousa Santos | C17: 10.25 | D17: =IF(C17<7.5,"Exame","") ->  | E17: 13 | F17: =ROUND(C17*0.7+E17*0.3,0) -> 11 | G17: =IF(F17<9.5,"Exame","Aprovado") -> Aprovado