A1: Turma 3
A2: Nº | B2: CURSO | C2: NOME | D2: Teste | E2: Nt. Final
A3: 2 | B3: COND.FISICA | C3: Ana Sofia Oliveira Dias | D3: 0 | E3: =IF(D3=0,"",ROUND(D3,0)) ->  | F3: =IF(E3="","",IF(E3<7.5,"Reprovado",IF(E3<9.5,"Oral",IF(E3>=9.5,"Aprovado")))) -> 
A4: 4 | B4: COND.FISICA | C4: Patricia Botas Faustino | D4: 12.5 | E4: =IF(D4=0,"",ROUND(D4,0)) -> 13 | F4: =IF(E4="","",IF(E4<7.5,"Reprovado",IF(E4<9.5,"Oral",IF(E4>=9.5,"Aprovado")))) -> Aprovado | G4: x
A5: 9 | B5: COND.FISICA | C5: Mauro José Nobre Costa | D5: 0 | E5: =IF(D5=0,"",ROUND(D5,0)) ->  | F5: =IF(E5="","",IF(E5<7.5,"Reprovado",IF(E5<9.5,"Oral",IF(E5>=9.5,"Aprovado")))) -> 
A6: 19 | B6: COND.FISICA | C6: António Domingos Coelho | D6: 4 | E6: =IF(D6=0,"",ROUND(D6,0)) -> 4 | F6: =IF(E6="","",IF(E6<7.5,"Reprovado",IF(E6<9.5,"Oral",IF(E6>=9.5,"Aprovado")))) -> Reprovado | G6: x
A7: 28 | B7: COND.FISICA | C7: Sónia Maria Silva Pinho | D7: 12.007142857142858 | E7: =IF(D7=0,"",ROUND(D7,0)) -> 12 | F7: =IF(E7="","",IF(E7<7.5,"Reprovado",IF(E7<9.5,"Oral",IF(E7>=9.5,"Aprovado")))) -> Aprovado | G7: x
A8: 32 | B8: COND.FISICA | C8: Vitor Hugo Garcia Luis | D8: 0 | E8: =IF(D8=0,"",ROUND(D8,0)) ->  | F8: =IF(E8="","",IF(E8<7.5,"Reprovado",IF(E8<9.5,"Oral",IF(E8>=9.5,"Aprovado")))) -> 
A9: 38 | B9: COND.FISICA | C9: Ricardo Melo Santos | D9: 0 | E9: =IF(D9=0,"",ROUND(D9,0)) ->  | F9: =IF(E9="","",IF(E9<7.5,"Reprovado",IF(E9<9.5,"Oral",IF(E9>=9.5,"Aprovado")))) -> 
A10: 45 | B10: COND.FISICA | C10: Pedro Graça Carriço | D10: 0 | E10: =IF(D10=0,"",ROUND(D10,0)) ->  | F10: =IF(E10="","",IF(E10<7.5,"Reprovado",IF(E10<9.5,"Oral",IF(E10>=9.5,"Aprovado")))) -> 
A11: 49 | B11: COND.FISICA | C11: Paulo Miguel Santos Dias | D11: 0 | E11: =IF(D11=0,"",ROUND(D11,0)) ->  | F11: =IF(E11="","",IF(E11<7.5,"Reprovado",IF(E11<9.5,"Oral",IF(E11>=9.5,"Aprovado")))) -> 
A12: 55 | B12: COND.FISICA | C12: Ana Isabel Machado Cardoso | D12: 0 | E12: =IF(D12=0,"",ROUND(D12,0)) ->  | F12: =IF(E12="","",IF(E12<7.5,"Reprovado",IF(E12<9.5,"Oral",IF(E12>=9.5,"Aprovado")))) -> 
A13: 64 | B13: COND.FISICA | C13: Andrea Soares Gonçalves | D13: 0 | E13: =IF(D13=0,"",ROUND(D13,0)) ->  | F13: =IF(E13="","",IF(E13<7.5,"Reprovado",IF(E13<9.5,"Oral",IF(E13>=9.5,"Aprovado")))) -> 
A14: 76 | B14: COND.FISICA | C14: Marisa Carvalho Gomes | D14: 0 | E14: =IF(D14=0,"",ROUND(D14,0)) ->  | F14: =IF(E14="","",IF(E14<7.5,"Reprovado",IF(E14<9.5,"Oral",IF(E14>=9.5,"Aprovado")))) -> 
A15: 82 | B15: COND.FISICA | C15: Mónica Martins Fernandes | D15: 0 | E15: =IF(D15=0,"",ROUND(D15,0)) ->  | F15: =IF(E15="","",IF(E15<7.5,"Reprovado",IF(E15<9.5,"Oral",IF(E15>=9.5,"Aprovado")))) -> 
A16: 90 | B16: COND.FISICA | C16: Isabel Moita Ferreira | D16: 12.766666666666666 | E16: =IF(D16=0,"",ROUND(D16,0)) -> 13 | F16: =IF(E16="","",IF(E16<7.5,"Reprovado",IF(E16<9.5,"Oral",IF(E16>=9.5,"Aprovado")))) -> Aprovado | G16: x
A17: 94 | B17: COND.FISICA | C17: Teresa Sofia Amorim Mendes | D17: 0 | E17: =IF(D17=0,"",ROUND(D17,0)) ->  | F17: =IF(E17="","",IF(E17<7.5,"Reprovado",IF(E17<9.5,"Oral",IF(E17>=9.5,"Aprovado")))) -> 
A18: 96 | B18: COND.FISICA | C18: Mónica Isabel Alves Santos | D18: 0 | E18: =IF(D18=0,"",ROUND(D18,0)) ->  | F18: =IF(E18="","",IF(E18<7.5,"Reprovado",IF(E18<9.5,"Oral",IF(E18>=9.5,"Aprovado")))) -> 
A19: 107 | B19: COND.FISICA | C19: Joana Rita Martins Azul | D19: 0 | E19: =IF(D19=0,"",ROUND(D19,0)) ->  | F19: =IF(E19="","",IF(E19<7.5,"Reprovado",IF(E19<9.5,"Oral",IF(E19>=9.5,"Aprovado")))) -> 
A20: 109 | B20: COND.FISICA | C20: Sandra Nunes Martins | D20: 0 | E20: =IF(D20=0,"",ROUND(D20,0)) ->  | F20: =IF(E20="","",IF(E20<7.5,"Reprovado",IF(E20<9.5,"Oral",IF(E20>=9.5,"Aprovado")))) -> 
A21: 111 | B21: COND.FISICA | C21: João Filipe Borges Fernandes | D21: 0 | E21: =IF(D21=0,"",ROUND(D21,0)) ->  | F21: =IF(E21="","",IF(E21<7.5,"Reprovado",IF(E21<9.5,"Oral",IF(E21>=9.5,"Aprovado")))) -> 
A22: 117 | B22: COND.FISICA | C22: Maura Simões Alves | D22: 0 | E22: =IF(D22=0,"",ROUND(D22,0)) ->  | F22: =IF(E22="","",IF(E22<7.5,"Reprovado",IF(E22<9.5,"Oral",IF(E22>=9.5,"Aprovado")))) -> 
A23: 122 | B23: COND.FISICA | C23: Carlos Rodrigues Matos | D23: 7.6571428571428575 | E23: =IF(D23=0,"",ROUND(D23,0)) -> 8 | F23: =IF(E23="","",IF(E23<7.5,"Reprovado",IF(E23<9.5,"Oral",IF(E23>=9.5,"Aprovado")))) -> Oral | G23: x
A24: 135 | B24: COND.FISICA | C24: Gonçalo Chorão Beirão | D24: 0 | E24: =IF(D24=0,"",ROUND(D24,0)) ->  | F24: =IF(E24="","",IF(E24<7.5,"Reprovado",IF(E24<9.5,"Oral",IF(E24>=9.5,"Aprovado")))) -> 
A25: 141 | B25: COND.FISICA | C25: Eduardo Jorge Caetano Sousa | D25: 0 | E25: =IF(D25=0,"",ROUND(D25,0)) ->  | F25: =IF(E25="","",IF(E25<7.5,"Reprovado",IF(E25<9.5,"Oral",IF(E25>=9.5,"Aprovado")))) -> 
A26: 98/18 | B26: COND.FISICA | C26: Luis Miguel Courinha Rosa | D26: 0 | E26: =IF(D26=0,"",ROUND(D26,0)) ->  | F26: =IF(E26="","",IF(E26<7.5,"Reprovado",IF(E26<9.5,"Oral",IF(E26>=9.5,"Aprovado")))) -> 
A27: 99/126 | B27: COND.FISICA | C27: Pedro Nuno Tedim Campos | D27: 0 | E27: =IF(D27=0,"",ROUND(D27,0)) ->  | F27: =IF(E27="","",IF(E27<7.5,"Reprovado",IF(E27<9.5,"Oral",IF(E27>=9.5,"Aprovado")))) -> 
A28: 99/135 | B28: COND.FISICA | C28: Susana Queirós Barbosa | D28: 0 | E28: =IF(D28=0,"",ROUND(D28,0)) ->  | F28: =IF(E28="","",IF(E28<7.5,"Reprovado",IF(E28<9.5,"Oral",IF(E28>=9.5,"Aprovado")))) -> 
A29: 99/73 | B29: COND.FISICA | C29: Paulo Granado Seixal | D29: 9.5 | E29: =IF(D29=0,"",ROUND(D29,0)) -> 10 | F29: =IF(E29="","",IF(E29<7.5,"Reprovado",IF(E29<9.5,"Oral",IF(E29>=9.5,"Aprovado")))) -> Aprovado | G29: x
E30: =IF(D30=0,"",ROUND(D30,0)) -> 