A1: Num. | B1: Curso | C1: Nome | D1: Teste | E1: Nt. Final
A2: 7 | B2: FUTEBOL | C2: Fernando Bernardo Tavares | D2: 0 | E2: =IF(D2=0,"",ROUND(D2,0)) ->  | F2: =IF(E2="","",IF(E2<7.5,"Reprovado",IF(E2<9.5,"Oral",IF(E2>=9.5,"Aprovado")))) -> 
A3: 8 | B3: FUTEBOL | C3: Nuno Custodio Bernardo | D3: 0 | E3: =IF(D3=0,"",ROUND(D3,0)) ->  | F3: =IF(E3="","",IF(E3<7.5,"Reprovado",IF(E3<9.5,"Oral",IF(E3>=9.5,"Aprovado")))) -> 
A4: 11 | B4: FUTEBOL | C4: Miguel Santos Marques | D4: 0 | E4: =IF(D4=0,"",ROUND(D4,0)) ->  | F4: =IF(E4="","",IF(E4<7.5,"Reprovado",IF(E4<9.5,"Oral",IF(E4>=9.5,"Aprovado")))) -> 
A5: 13 | B5: FUTEBOL | C5: Diogo Correia Bartolo | D5: 9.5031999999999996 | E5: =IF(D5=0,"",ROUND(D5,0)) -> 10 | F5: =IF(E5="","",IF(E5<7.5,"Reprovado",IF(E5<9.5,"Oral",IF(E5>=9.5,"Aprovado")))) -> Aprovado
A6: 15 | B6: FUTEBOL | C6: Romão Azevedo Ferreira | D6: 9.5139999999999993 | E6: =IF(D6=0,"",ROUND(D6,0)) -> 10 | F6: =IF(E6="","",IF(E6<7.5,"Reprovado",IF(E6<9.5,"Oral",IF(E6>=9.5,"Aprovado")))) -> Aprovado
A7: 17 | B7: FUTEBOL | C7: João José Gavancha Carrilho | D7: 0 | E7: =IF(D7=0,"",ROUND(D7,0)) ->  | F7: =IF(E7="","",IF(E7<7.5,"Reprovado",IF(E7<9.5,"Oral",IF(E7>=9.5,"Aprovado")))) -> 
A8: 20 | B8: FUTEBOL | C8: Diogo Martins Cruz António | D8: 12.216666666666667 | E8: =IF(D8=0,"",ROUND(D8,0)) -> 12 | F8: =IF(E8="","",IF(E8<7.5,"Reprovado",IF(E8<9.5,"Oral",IF(E8>=9.5,"Aprovado")))) -> Aprovado
A9: 23 | B9: FUTEBOL | C9: Nuno Miguel Vieira Domingos | D9: 0 | E9: =IF(D9=0,"",ROUND(D9,0)) ->  | F9: =IF(E9="","",IF(E9<7.5,"Reprovado",IF(E9<9.5,"Oral",IF(E9>=9.5,"Aprovado")))) -> 
A10: 29 | B10: FUTEBOL | C10: Renato Godinho Ribeiro | D10: 11.599959999999999 | E10: =IF(D10=0,"",ROUND(D10,0)) -> 12 | F10: =IF(E10="","",IF(E10<7.5,"Reprovado",IF(E10<9.5,"Oral",IF(E10>=9.5,"Aprovado")))) -> Aprovado
A11: 40 | B11: FUTEBOL | C11: Eduardo Magalhães Teixeira | D11: 0 | E11: =IF(D11=0,"",ROUND(D11,0)) ->  | F11: =IF(E11="","",IF(E11<7.5,"Reprovado",IF(E11<9.5,"Oral",IF(E11>=9.5,"Aprovado")))) -> 
A12: 54 | B12: FUTEBOL | C12: Nuno Justino Pereira | D12: 0 | E12: =IF(D12=0,"",ROUND(D12,0)) ->  | F12: =IF(E12="","",IF(E12<7.5,"Reprovado",IF(E12<9.5,"Oral",IF(E12>=9.5,"Aprovado")))) -> 
A13: 58 | B13: FUTEBOL | C13: João Carlos Valado Tralhão | D13: 0 | E13: =IF(D13=0,"",ROUND(D13,0)) ->  | F13: =IF(E13="","",IF(E13<7.5,"Reprovado",IF(E13<9.5,"Oral",IF(E13>=9.5,"Aprovado")))) -> 
A14: 59 | B14: FUTEBOL | C14: Rolando Mendes Carrasco | D14: 9.5 | E14: =IF(D14=0,"",ROUND(D14,0)) -> 10 | F14: =IF(E14="","",IF(E14<7.5,"Reprovado",IF(E14<9.5,"Oral",IF(E14>=9.5,"Aprovado")))) -> Aprovado
A15: 65 | B15: FUTEBOL | C15: Paulo Jorge Pires Silva | D15: 7.315666666666667 | E15: =IF(D15=0,"",ROUND(D15,0)) -> 7 | F15: =IF(E15="","",IF(E15<7.5,"Reprovado",IF(E15<9.5,"Oral",IF(E15>=9.5,"Aprovado")))) -> Reprovado
A16: 66 | B16: FUTEBOL | C16: André Fonseca Sousa | D16: 9.5448380952380951 | E16: =IF(D16=0,"",ROUND(D16,0)) -> 10 | F16: =IF(E16="","",IF(E16<7.5,"Reprovado",IF(E16<9.5,"Oral",IF(E16>=9.5,"Aprovado")))) -> Aprovado
A17: 73 | B17: FUTEBOL | C17: Rui Jorge Castanheira Castro | D17: 0 | E17: =IF(D17=0,"",ROUND(D17,0)) ->  | F17: =IF(E17="","",IF(E17<7.5,"Reprovado",IF(E17<9.5,"Oral",IF(E17>=9.5,"Aprovado")))) -> 
A18: 80 | B18: FUTEBOL | C18: Claudia Silva Esteves | D18: 0 | E18: =IF(D18=0,"",ROUND(D18,0)) ->  | F18: =IF(E18="","",IF(E18<7.5,"Reprovado",IF(E18<9.5,"Oral",IF(E18>=9.5,"Aprovado")))) -> 
A19: 81 | B19: FUTEBOL | C19: Bruno Duarte Carmo | D19: 0 | E19: =IF(D19=0,"",ROUND(D19,0)) ->  | F19: =IF(E19="","",IF(E19<7.5,"Reprovado",IF(E19<9.5,"Oral",IF(E19>=9.5,"Aprovado")))) -> 
A20: 84 | B20: FUTEBOL | C20: Luis Filipe Saraiva Coelho | D20: 0 | E20: =IF(D20=0,"",ROUND(D20,0)) ->  | F20: =IF(E20="","",IF(E20<7.5,"Reprovado",IF(E20<9.5,"Oral",IF(E20>=9.5,"Aprovado")))) -> 
A21: 88 | B21: FUTEBOL | C21: Helder Formas Tavares | D21: 0 | E21: =IF(D21=0,"",ROUND(D21,0)) ->  | F21: =IF(E21="","",IF(E21<7.5,"Reprovado",IF(E21<9.5,"Oral",IF(E21>=9.5,"Aprovado")))) -> 
A22: 98 | B22: FUTEBOL | C22: António Miguel Gomes Romão | D22: 0 | E22: =IF(D22=0,"",ROUND(D22,0)) ->  | F22: =IF(E22="","",IF(E22<7.5,"Reprovado",IF(E22<9.5,"Oral",IF(E22>=9.5,"Aprovado")))) -> 
A23: 101 | B23: FUTEBOL | C23: Filipe Valente Morais | D23: 0 | E23: =IF(D23=0,"",ROUND(D23,0)) ->  | F23: =IF(E23="","",IF(E23<7.5,"Reprovado",IF(E23<9.5,"Oral",IF(E23>=9.5,"Aprovado")))) -> 
A24: 103 | B24: FUTEBOL | C24: Bruno Miguel Serafim Costa | D24: 5.1132190476190464 | E24: =IF(D24=0,"",ROUND(D24,0)) -> 5 | F24: =IF(E24="","",IF(E24<7.5,"Reprovado",IF(E24<9.5,"Oral",IF(E24>=9.5,"Aprovado")))) -> Reprovado
A25: 112 | B25: FUTEBOL | C25: Amaro Oliveira Ferreira | D25: 12.373409523809524 | E25: =IF(D25=0,"",ROUND(D25,0)) -> 12 | F25: =IF(E25="","",IF(E25<7.5,"Reprovado",IF(E25<9.5,"Oral",IF(E25>=9.5,"Aprovado")))) -> Aprovado
A26: 118 | B26: FUTEBOL | C26: João Morais Pereira Coelho | D26: 0 | E26: =IF(D26=0,"",ROUND(D26,0)) ->  | F26: =IF(E26="","",IF(E26<7.5,"Reprovado",IF(E26<9.5,"Oral",IF(E26>=9.5,"Aprovado")))) -> 
A27: 127 | B27: FUTEBOL | C27: Hugo Ramos Pinheiro | D27: 0 | E27: =IF(D27=0,"",ROUND(D27,0)) ->  | F27: =IF(E27="","",IF(E27<7.5,"Reprovado",IF(E27<9.5,"Oral",IF(E27>=9.5,"Aprovado")))) -> 
A28: 128 | B28: FUTEBOL | C28: Francisco Simões Andrade | D28: 6.0585714285714287 | E28: =IF(D28=0,"",ROUND(D28,0)) -> 6 | F28: =IF(E28="","",IF(E28<7.5,"Reprovado",IF(E28<9.5,"Oral",IF(E28>=9.5,"Aprovado")))) -> Reprovado
A29: 129 | B29: FUTEBOL | C29: João Pedro Salgado Silva | D29: 9.5147619047619063 | E29: =IF(D29=0,"",ROUND(D29,0)) -> 10 | F29: =IF(E29="","",IF(E29<7.5,"Reprovado",IF(E29<9.5,"Oral",IF(E29>=9.5,"Aprovado")))) -> Aprovado
A30: 140 | B30: FUTEBOL | C30: João José Barcelos Castro | D30: 0 | E30: =IF(D30=0,"",ROUND(D30,0)) ->  | F30: =IF(E30="","",IF(E30<7.5,"Reprovado",IF(E30<9.5,"Oral",IF(E30>=9.5,"Aprovado")))) -> 
A31: 142 | B31: FUTEBOL | C31: Nelson Cabrita Antunes | D31: 0 | E31: =IF(D31=0,"",ROUND(D31,0)) ->  | F31: =IF(E31="","",IF(E31<7.5,"Reprovado",IF(E31<9.5,"Oral",IF(E31>=9.5,"Aprovado")))) -> 
A32: 144 | B32: FUTEBOL | C32: Bruno Filipe Vieira Oliveira | D32: 10.5 | E32: =IF(D32=0,"",ROUND(D32,0)) -> 11 | F32: =IF(E32="","",IF(E32<7.5,"Reprovado",IF(E32<9.5,"Oral",IF(E32>=9.5,"Aprovado")))) -> Aprovado
A33: 98/24 | B33: FUTEBOL | C33: Ricardo Neves Silva | D33: 0 | E33: =IF(D33=0,"",ROUND(D33,0)) ->  | F33: =IF(E33="","",IF(E33<7.5,"Reprovado",IF(E33<9.5,"Oral",IF(E33>=9.5,"Aprovado")))) -> 
A34: 98/41 | B34: FUTEBOL | C34: José Simões Gouveia | D34: 5.99 | E34: =IF(D34=0,"",ROUND(D34,0)) -> 6 | F34: =IF(E34="","",IF(E34<7.5,"Reprovado",IF(E34<9.5,"Oral",IF(E34>=9.5,"Aprovado")))) -> Reprovado
A35: 99/101 | B35: FUTEBOL | C35: Artur Daniel Machado Silva | D35: 0 | E35: =IF(D35=0,"",ROUND(D35,0)) ->  | F35: =IF(E35="","",IF(E35<7.5,"Reprovado",IF(E35<9.5,"Oral",IF(E35>=9.5,"Aprovado")))) -> 
A36: 99/106 | B36: FUTEBOL | C36: Delfim Malainho Fernandes | D36: 8.8231428571428587 | E36: =IF(D36=0,"",ROUND(D36,0)) -> 9 | F36: =IF(E36="","",IF(E36<7.5,"Reprovado",IF(E36<9.5,"Oral",IF(E36>=9.5,"Aprovado")))) -> Oral
A37: 99/132 | B37: FUTEBOL | C37: Vitor Manuel Pereira Afonso | D37: 0 | E37: =IF(D37=0,"",ROUND(D37,0)) ->  | F37: =IF(E37="","",IF(E37<7.5,"Reprovado",IF(E37<9.5,"Oral",IF(E37>=9.5,"Aprovado")))) -> 
A38: 99/59 | B38: FUTEBOL | C38: Paulo Silva Carolino | D38: 0 | E38: =IF(D38=0,"",ROUND(D38,0)) ->  | F38: =IF(E38="","",IF(E38<7.5,"Reprovado",IF(E38<9.5,"Oral",IF(E38>=9.5,"Aprovado")))) -> 