A1: Turma 6
A2: Nº | B2: CURSO | C2: NOME | D2: Teste | E2: Nt. Final
A3: 16 | B3: ANI.REC.LAZER | C3: Raul Jesus Mota | D3: 0 | E3: =IF(D3=0,"",ROUND(D3,0)) ->  | F3: =IF(E3="","",IF(E3<7.5,"Reprovado",IF(E3<9.5,"Oral",IF(E3>=9.5,"Aprovado")))) -> 
A4: 25 | B4: ANI.REC.LAZER | C4: Carlos Conceição Batista | D4: 0 | E4: =IF(D4=0,"",ROUND(D4,0)) ->  | F4: =IF(E4="","",IF(E4<7.5,"Reprovado",IF(E4<9.5,"Oral",IF(E4>=9.5,"Aprovado")))) -> 
A5: 31 | B5: ANI.REC.LAZER | C5: Tiago José Vindima Ferreira | D5: 0 | E5: =IF(D5=0,"",ROUND(D5,0)) ->  | F5: =IF(E5="","",IF(E5<7.5,"Reprovado",IF(E5<9.5,"Oral",IF(E5>=9.5,"Aprovado")))) -> 
A6: 37 | B6: ANI.REC.LAZER | C6: Ricardo José Santo Melo | D6: 0 | E6: =IF(D6=0,"",ROUND(D6,0)) ->  | F6: =IF(E6="","",IF(E6<7.5,"Reprovado",IF(E6<9.5,"Oral",IF(E6>=9.5,"Aprovado")))) -> 
A7: 41 | B7: ANI.REC.LAZER | C7: Candido Pedro Mota Paris | D7: 0 | E7: =IF(D7=0,"",ROUND(D7,0)) ->  | F7: =IF(E7="","",IF(E7<7.5,"Reprovado",IF(E7<9.5,"Oral",IF(E7>=9.5,"Aprovado")))) -> 
A8: 42 | B8: ANI.REC.LAZER | C8: César Vitorino Oliveira | D8: 3.6630000000000003 | E8: =IF(D8=0,"",ROUND(D8,0)) -> 4 | F8: =IF(E8="","",IF(E8<7.5,"Reprovado",IF(E8<9.5,"Oral",IF(E8>=9.5,"Aprovado")))) -> Reprovado | G8: x
A9: 43 | B9: ANI.REC.LAZER | C9: Bruno Candido Baptista | D9: 0 | E9: =IF(D9=0,"",ROUND(D9,0)) ->  | F9: =IF(E9="","",IF(E9<7.5,"Reprovado",IF(E9<9.5,"Oral",IF(E9>=9.5,"Aprovado")))) -> 
A10: 51 | B10: ANI.REC.LAZER | C10: Nuno Pereira Henriques | D10: 0 | E10: =IF(D10=0,"",ROUND(D10,0)) ->  | F10: =IF(E10="","",IF(E10<7.5,"Reprovado",IF(E10<9.5,"Oral",IF(E10>=9.5,"Aprovado")))) -> 
A11: 60 | B11: ANI.REC.LAZER | C11: Abel Jorge Santos Lopes | D11: 6.1171428571428574 | E11: =IF(D11=0,"",ROUND(D11,0)) -> 6 | F11: =IF(E11="","",IF(E11<7.5,"Reprovado",IF(E11<9.5,"Oral",IF(E11>=9.5,"Aprovado")))) -> Reprovado | G11: x
A12: 62 | B12: ANI.REC.LAZER | C12: José Gonçalves Abreu | D12: 0 | E12: =IF(D12=0,"",ROUND(D12,0)) ->  | F12: =IF(E12="","",IF(E12<7.5,"Reprovado",IF(E12<9.5,"Oral",IF(E12>=9.5,"Aprovado")))) -> 
A13: 70 | B13: ANI.REC.LAZER | C13: Catarina Nobre Sousa Canha | D13: 7.28 | E13: =IF(D13=0,"",ROUND(D13,0)) -> 7 | F13: =IF(E13="","",IF(E13<7.5,"Reprovado",IF(E13<9.5,"Oral",IF(E13>=9.5,"Aprovado")))) -> Reprovado | G13: x
A14: 74 | B14: ANI.REC.LAZER | C14: Pedro Dinis Pereira | D14: 0 | E14: =IF(D14=0,"",ROUND(D14,0)) ->  | F14: =IF(E14="","",IF(E14<7.5,"Reprovado",IF(E14<9.5,"Oral",IF(E14>=9.5,"Aprovado")))) -> 
A15: 85 | B15: ANI.REC.LAZER | C15: Fernando Jacinto Ferreira | D15: 4.7204761904761909 | E15: =IF(D15=0,"",ROUND(D15,0)) -> 5 | F15: =IF(E15="","",IF(E15<7.5,"Reprovado",IF(E15<9.5,"Oral",IF(E15>=9.5,"Aprovado")))) -> Reprovado | G15: x
A16: 91 | B16: ANI.REC.LAZER | C16: Mário João Violante Santos | D16: 0 | E16: =IF(D16=0,"",ROUND(D16,0)) ->  | F16: =IF(E16="","",IF(E16<7.5,"Reprovado",IF(E16<9.5,"Oral",IF(E16>=9.5,"Aprovado")))) -> 
A17: 97 | B17: ANI.REC.LAZER | C17: Filipe Dâmaso Nunes Gomes | D17: 6.6304428571428566 | E17: =IF(D17=0,"",ROUND(D17,0)) -> 7 | F17: =IF(E17="","",IF(E17<7.5,"Reprovado",IF(E17<9.5,"Oral",IF(E17>=9.5,"Aprovado")))) -> Reprovado | G17: x
A18: 106 | B18: ANI.REC.LAZER | C18: Daniel João Santos Louro | D18: 0 | E18: =IF(D18=0,"",ROUND(D18,0)) ->  | F18: =IF(E18="","",IF(E18<7.5,"Reprovado",IF(E18<9.5,"Oral",IF(E18>=9.5,"Aprovado")))) -> 
A19: 121 | B19: ANI.REC.LAZER | C19: Valter José Dias Vilela | D19: 0 | E19: =IF(D19=0,"",ROUND(D19,0)) ->  | F19: =IF(E19="","",IF(E19<7.5,"Reprovado",IF(E19<9.5,"Oral",IF(E19>=9.5,"Aprovado")))) -> 
A20: 126 | B20: ANI.REC.LAZER | C20: Frederico Silva Tiago | D20: 0 | E20: =IF(D20=0,"",ROUND(D20,0)) ->  | F20: =IF(E20="","",IF(E20<7.5,"Reprovado",IF(E20<9.5,"Oral",IF(E20>=9.5,"Aprovado")))) -> 
A21: 131 | B21: ANI.REC.LAZER | C21: João Miguel Salgado Jesus | D21: 0 | E21: =IF(D21=0,"",ROUND(D21,0)) ->  | F21: =IF(E21="","",IF(E21<7.5,"Reprovado",IF(E21<9.5,"Oral",IF(E21>=9.5,"Aprovado")))) -> 
A22: 143 | B22: ANI.REC.LAZER | C22: João Carlos Pereira Girão | D22: 0 | E22: =IF(D22=0,"",ROUND(D22,0)) ->  | F22: =IF(E22="","",IF(E22<7.5,"Reprovado",IF(E22<9.5,"Oral",IF(E22>=9.5,"Aprovado")))) -> 
A23: 99/114 | B23: ANI.REC.LAZER | C23: Gonçalo Simões Azevedo | D23: 5.93 | E23: 6 | F23: =IF(E23="","",IF(E23<7.5,"Reprovado",IF(E23<9.5,"Oral",IF(E23>=9.5,"Aprovado")))) -> Reprovado | G23: x