A1: Turma 5
A2: Nº | B2: CURSO | C2: NOME | D2: Teste | E2: Nt. Final
A3: 1 | B3: ANI.REC.LAZER | C3: Hugo Saraiva Martins | D3: 0 | E3: =IF(D3=0,"",ROUND(D3,0)) ->  | F3: =IF(E3="","",IF(E3<7.5,"Reprovado",IF(E3<9.5,"Oral",IF(E3>=9.5,"Aprovado")))) -> 
A4: 12 | B4: ANI.REC.LAZER | C4: Vasco Miguel Silva Oliveira | D4: 0 | E4: =IF(D4=0,"",ROUND(D4,0)) ->  | F4: =IF(E4="","",IF(E4<7.5,"Reprovado",IF(E4<9.5,"Oral",IF(E4>=9.5,"Aprovado")))) ->  | I4: Exame | J4: 14
A5: 21 | B5: ANI.REC.LAZER | C5: Rui Pedro Silva Pereira | D5: 10.796666666666667 | E5: =IF(D5=0,"",ROUND(D5,0)) -> 11 | F5: =IF(E5="","",IF(E5<7.5,"Reprovado",IF(E5<9.5,"Oral",IF(E5>=9.5,"Aprovado")))) -> Aprovado | G5: x
A6: 27 | B6: ANI.REC.LAZER | C6: Nuno Martins Narciso | D6: 0 | E6: =IF(D6=0,"",ROUND(D6,0)) ->  | F6: =IF(E6="","",IF(E6<7.5,"Reprovado",IF(E6<9.5,"Oral",IF(E6>=9.5,"Aprovado")))) -> 
A7: 30 | B7: ANI.REC.LAZER | C7: Isabel Santos Vieira | D7: 0 | E7: =IF(D7=0,"",ROUND(D7,0)) ->  | F7: =IF(E7="","",IF(E7<7.5,"Reprovado",IF(E7<9.5,"Oral",IF(E7>=9.5,"Aprovado")))) -> 
A8: 35 | B8: ANI.REC.LAZER | C8: Luis Miguel Rodrigues Lazaro | D8: 0 | E8: =IF(D8=0,"",ROUND(D8,0)) ->  | F8: =IF(E8="","",IF(E8<7.5,"Reprovado",IF(E8<9.5,"Oral",IF(E8>=9.5,"Aprovado")))) -> 
A9: 46 | B9: ANI.REC.LAZER | C9: Silvia Rodrigues Areia | D9: 11.046666666666665 | E9: =IF(D9=0,"",ROUND(D9,0)) -> 11 | F9: =IF(E9="","",IF(E9<7.5,"Reprovado",IF(E9<9.5,"Oral",IF(E9>=9.5,"Aprovado")))) -> Aprovado | G9: x
A10: 53 | B10: ANI.REC.LAZER | C10: Nuno Miguel Matos Costa | D10: 0 | E10: =IF(D10=0,"",ROUND(D10,0)) ->  | F10: =IF(E10="","",IF(E10<7.5,"Reprovado",IF(E10<9.5,"Oral",IF(E10>=9.5,"Aprovado")))) -> 
A11: 67 | B11: ANI.REC.LAZER | C11: Mário Dinis Mendes Silva | D11: 0 | E11: =IF(D11=0,"",ROUND(D11,0)) ->  | F11: =IF(E11="","",IF(E11<7.5,"Reprovado",IF(E11<9.5,"Oral",IF(E11>=9.5,"Aprovado")))) -> 
A12: 72 | B12: ANI.REC.LAZER | C12: Claudia Temporão Filipe | D12: 6.753333333333333 | E12: =IF(D12=0,"",ROUND(D12,0)) -> 7 | F12: =IF(E12="","",IF(E12<7.5,"Reprovado",IF(E12<9.5,"Oral",IF(E12>=9.5,"Aprovado")))) -> Reprovado | G12: x
A13: 75 | B13: ANI.REC.LAZER | C13: Paulo Jorge Moniz Pacheco | D13: 0 | E13: =IF(D13=0,"",ROUND(D13,0)) ->  | F13: =IF(E13="","",IF(E13<7.5,"Reprovado",IF(E13<9.5,"Oral",IF(E13>=9.5,"Aprovado")))) -> 
A14: 89 | B14: ANI.REC.LAZER | C14: Pedro Lopes Castanheira | D14: 0 | E14: =IF(D14=0,"",ROUND(D14,0)) ->  | F14: =IF(E14="","",IF(E14<7.5,"Reprovado",IF(E14<9.5,"Oral",IF(E14>=9.5,"Aprovado")))) -> 
A15: 92 | B15: ANI.REC.LAZER | C15: Gonçalo Pedro Lucas Silva | D15: 5.0961538461538467 | E15: 5 | F15: =IF(E15="","",IF(E15<7.5,"Reprovado",IF(E15<9.5,"Oral",IF(E15>=9.5,"Aprovado")))) -> Reprovado | G15: x
A16: 100 | B16: ANI.REC.LAZER | C16: João Pedro Marques Duarte | D16: 0 | E16: =IF(D16=0,"",ROUND(D16,0)) ->  | F16: =IF(E16="","",IF(E16<7.5,"Reprovado",IF(E16<9.5,"Oral",IF(E16>=9.5,"Aprovado")))) -> 
A17: 102 | B17: ANI.REC.LAZER | C17: Lucia Cardoso Almeida | D17: 0 | E17: =IF(D17=0,"",ROUND(D17,0)) ->  | F17: =IF(E17="","",IF(E17<7.5,"Reprovado",IF(E17<9.5,"Oral",IF(E17>=9.5,"Aprovado")))) -> 
A18: 104 | B18: ANI.REC.LAZER | C18: Marcia Aleixo Vilela | D18: 0 | E18: =IF(D18=0,"",ROUND(D18,0)) ->  | F18: =IF(E18="","",IF(E18<7.5,"Reprovado",IF(E18<9.5,"Oral",IF(E18>=9.5,"Aprovado")))) -> 
A19: 108 | B19: ANI.REC.LAZER | C19: Henrique Antunes Hilário | D19: 9.57 | E19: =IF(D19=0,"",ROUND(D19,0)) -> 10 | F19: =IF(E19="","",IF(E19<7.5,"Reprovado",IF(E19<9.5,"Oral",IF(E19>=9.5,"Aprovado")))) -> Aprovado | G19: x
A20: 120 | B20: ANI.REC.LAZER | C20: Ana Mafalda Pereira Silva | D20: 0 | E20: =IF(D20=0,"",ROUND(D20,0)) ->  | F20: =IF(E20="","",IF(E20<7.5,"Reprovado",IF(E20<9.5,"Oral",IF(E20>=9.5,"Aprovado")))) -> 
A21: 124 | B21: ANI.REC.LAZER | C21: Hugo Renato Oliveira Silva | D21: 0 | E21: =IF(D21=0,"",ROUND(D21,0)) ->  | F21: =IF(E21="","",IF(E21<7.5,"Reprovado",IF(E21<9.5,"Oral",IF(E21>=9.5,"Aprovado")))) -> 
A22: 130 | B22: ANI.REC.LAZER | C22: Gonçalo Paulo Cruz | D22: 0 | E22: =IF(D22=0,"",ROUND(D22,0)) ->  | F22: =IF(E22="","",IF(E22<7.5,"Reprovado",IF(E22<9.5,"Oral",IF(E22>=9.5,"Aprovado")))) -> 
A23: 134 | B23: ANI.REC.LAZER | C23: David Castanheira Galvão | D23: 0 | E23: =IF(D23=0,"",ROUND(D23,0)) ->  | F23: =IF(E23="","",IF(E23<7.5,"Reprovado",IF(E23<9.5,"Oral",IF(E23>=9.5,"Aprovado")))) -> 
A24: 138 | B24: ANI.REC.LAZER | C24: Silvia Marques Araujo | D24: 0 | E24: =IF(D24=0,"",ROUND(D24,0)) ->  | F24: =IF(E24="","",IF(E24<7.5,"Reprovado",IF(E24<9.5,"Oral",IF(E24>=9.5,"Aprovado")))) -> 
A25: 139 | B25: ANI.REC.LAZER | C25: Nuno João Marques Araujo | D25: 5.4666666666666668 | E25: =IF(D25=0,"",ROUND(D25,0)) -> 5 | F25: =IF(E25="","",IF(E25<7.5,"Reprovado",IF(E25<9.5,"Oral",IF(E25>=9.5,"Aprovado")))) -> Reprovado | G25: x
A26: 146 | B26: ANI.REC.LAZER | C26: Sónia Pereira Carvalho | D26: 8.8833333333333329 | E26: =IF(D26=0,"",ROUND(D26,0)) -> 9 | F26: =IF(E26="","",IF(E26<7.5,"Reprovado",IF(E26<9.5,"Oral",IF(E26>=9.5,"Aprovado")))) -> Oral | G26: x
A27: 99/85 | B27: ANI.REC.LAZER | C27: Luis Filipe Cruz Gomes | D27: 0 | E27: =IF(D27=0,"",ROUND(D27,0)) ->  | F27: =IF(E27="","",IF(E27<7.5,"Reprovado",IF(E27<9.5,"Oral",IF(E27>=9.5,"Aprovado")))) -> 