A1: Turma 1
A2: Nº | B2: CURSO | C2: NOME | D2: Teste | E2: Nt. Final
A3: 5 | B3: Basquetebol | C3: Catarina Sarmento Mendes | D3: 0 | E3: =IF(D3=0,"",ROUND(D3,0)) ->  | F3: =IF(E3="","",IF(E3<7.5,"Reprovado",IF(E3<9.5,"Oral",IF(E3>=9.5,"Aprovado")))) -> 
A4: 6 | B4: Natação | C4: Alda Paula Melro Leandro | D4: 10.653333333333334 | E4: =IF(D4=0,"",ROUND(D4,0)) -> 11 | F4: =IF(E4="","",IF(E4<7.5,"Reprovado",IF(E4<9.5,"Oral",IF(E4>=9.5,"Aprovado")))) -> Aprovado | G4: x
A5: 14 | B5: Natação | C5: Andreia Faria Ferreira | D5: 0 | E5: =IF(D5=0,"",ROUND(D5,0)) ->  | F5: =IF(E5="","",IF(E5<7.5,"Reprovado",IF(E5<9.5,"Oral",IF(E5>=9.5,"Aprovado")))) -> 
A6: 22 | B6: Natação | C6: Ana Isabel Trindade Nogueira | D6: 0 | E6: =IF(D6=0,"",ROUND(D6,0)) ->  | F6: =IF(E6="","",IF(E6<7.5,"Reprovado",IF(E6<9.5,"Oral",IF(E6>=9.5,"Aprovado")))) -> 
A7: 26 | B7: Natação | C7: Filipa Alexandra Coelho | D7: 0 | E7: =IF(D7=0,"",ROUND(D7,0)) ->  | F7: =IF(E7="","",IF(E7<7.5,"Reprovado",IF(E7<9.5,"Oral",IF(E7>=9.5,"Aprovado")))) -> 
A8: 34 | B8: Natação | C8: Ana Teresa Conceição | D8: 11.647600000000001 | E8: =IF(D8=0,"",ROUND(D8,0)) -> 12 | F8: =IF(E8="","",IF(E8<7.5,"Reprovado",IF(E8<9.5,"Oral",IF(E8>=9.5,"Aprovado")))) -> Aprovado | G8: x
A9: 47 | B9: Atletismo | C9: Marciano António Graça | D9: 0 | E9: =IF(D9=0,"",ROUND(D9,0)) ->  | F9: =IF(E9="","",IF(E9<7.5,"Reprovado",IF(E9<9.5,"Oral",IF(E9>=9.5,"Aprovado")))) -> 
A10: 48 | B10: Basquetebol | C10: António Batista Francisco | D10: 7.4665999999999997 | E10: =IF(D10=0,"",ROUND(D10,0)) -> 7 | F10: =IF(E10="","",IF(E10<7.5,"Reprovado",IF(E10<9.5,"Oral",IF(E10>=9.5,"Aprovado")))) -> Reprovado | G10: x
A11: 50 | B11: Ginastica | C11: Cecilia Gonçalves Simão | D11: 12.070355238095239 | E11: =IF(D11=0,"",ROUND(D11,0)) -> 12 | F11: =IF(E11="","",IF(E11<7.5,"Reprovado",IF(E11<9.5,"Oral",IF(E11>=9.5,"Aprovado")))) -> Aprovado | G11: x
A12: 52 | B12: Ginastica | C12: Joana Macedo Oliveira | D12: 9.5809523809523807 | E12: =IF(D12=0,"",ROUND(D12,0)) -> 10 | F12: =IF(E12="","",IF(E12<7.5,"Reprovado",IF(E12<9.5,"Oral",IF(E12>=9.5,"Aprovado")))) -> Aprovado | G12: x
A13: 63 | B13: Natação | C13: Alberto Filipe Santos Guedes | D13: 0 | E13: =IF(D13=0,"",ROUND(D13,0)) ->  | F13: =IF(E13="","",IF(E13<7.5,"Reprovado",IF(E13<9.5,"Oral",IF(E13>=9.5,"Aprovado")))) -> 
A14: 69 | B14: Natação | C14: João Paulo Lopes Osorio | D14: 0 | E14: =IF(D14=0,"",ROUND(D14,0)) ->  | F14: =IF(E14="","",IF(E14<7.5,"Reprovado",IF(E14<9.5,"Oral",IF(E14>=9.5,"Aprovado")))) -> 
A15: 71 | B15: Ginástica | C15: Elsa Carina Silva Freitas | D15: 0 | E15: =IF(D15=0,"",ROUND(D15,0)) ->  | F15: =IF(E15="","",IF(E15<7.5,"Reprovado",IF(E15<9.5,"Oral",IF(E15>=9.5,"Aprovado")))) -> 
A16: 77 | B16: Basquetebol | C16: Ana Margarida Arroios Faria | D16: 0 | E16: =IF(D16=0,"",ROUND(D16,0)) ->  | F16: =IF(E16="","",IF(E16<7.5,"Reprovado",IF(E16<9.5,"Oral",IF(E16>=9.5,"Aprovado")))) -> 
A17: 79 | B17: Natação | C17: Miguel Meireles Silva | D17: 0 | E17: =IF(D17=0,"",ROUND(D17,0)) ->  | F17: =IF(E17="","",IF(E17<7.5,"Reprovado",IF(E17<9.5,"Oral",IF(E17>=9.5,"Aprovado")))) -> 
A18: 83 | B18: Natação | C18: Carla Monteiro Rodrigues | D18: 0 | E18: =IF(D18=0,"",ROUND(D18,0)) ->  | F18: =IF(E18="","",IF(E18<7.5,"Reprovado",IF(E18<9.5,"Oral",IF(E18>=9.5,"Aprovado")))) -> 
A19: 86 | B19: Natação | C19: Nuno Miguel Antunes Santos | D19: 0 | E19: =IF(D19=0,"",ROUND(D19,0)) ->  | F19: =IF(E19="","",IF(E19<7.5,"Reprovado",IF(E19<9.5,"Oral",IF(E19>=9.5,"Aprovado")))) -> 
A20: 110 | B20: Natação | C20: Pedro Manuel Cruz Bento | D20: 0 | E20: =IF(D20=0,"",ROUND(D20,0)) ->  | F20: =IF(E20="","",IF(E20<7.5,"Reprovado",IF(E20<9.5,"Oral",IF(E20>=9.5,"Aprovado")))) -> 
A21: 113 | B21: Ginastica | C21: Hugo Oliveira Laranjeira | D21: 0 | E21: =IF(D21=0,"",ROUND(D21,0)) ->  | F21: =IF(E21="","",IF(E21<7.5,"Reprovado",IF(E21<9.5,"Oral",IF(E21>=9.5,"Aprovado")))) -> 
A22: 114 | B22: Natação | C22: João Pedro Ferreira Mendes | D22: 0 | E22: =IF(D22=0,"",ROUND(D22,0)) ->  | F22: =IF(E22="","",IF(E22<7.5,"Reprovado",IF(E22<9.5,"Oral",IF(E22>=9.5,"Aprovado")))) -> 
A23: 116 | B23: Natação | C23: Filomena Natividade Silva | D23: 6.2566666666666668 | E23: =IF(D23=0,"",ROUND(D23,0)) -> 6 | F23: =IF(E23="","",IF(E23<7.5,"Reprovado",IF(E23<9.5,"Oral",IF(E23>=9.5,"Aprovado")))) -> Reprovado | G23: x
A24: 123 | B24: Natação | C24: Alexandra Silva Coelho | D24: 0 | E24: =IF(D24=0,"",ROUND(D24,0)) ->  | F24: =IF(E24="","",IF(E24<7.5,"Reprovado",IF(E24<9.5,"Oral",IF(E24>=9.5,"Aprovado")))) -> 
A25: 125 | B25: Natação | C25: Pedro Rodrigues Oliveira | D25: 0 | E25: =IF(D25=0,"",ROUND(D25,0)) ->  | F25: =IF(E25="","",IF(E25<7.5,"Reprovado",IF(E25<9.5,"Oral",IF(E25>=9.5,"Aprovado")))) -> 
A26: 132 | B26: Basquetebol | C26: Nuno Miguel Almeida Mendonça | D26: 0 | E26: =IF(D26=0,"",ROUND(D26,0)) ->  | F26: =IF(E26="","",IF(E26<7.5,"Reprovado",IF(E26<9.5,"Oral",IF(E26>=9.5,"Aprovado")))) -> 
A27: 137 | B27: Andebol | C27: Rui Pedro Marques Antunes | D27: 10.716666666666667 | E27: =IF(D27=0,"",ROUND(D27,0)) -> 11 | F27: =IF(E27="","",IF(E27<7.5,"Reprovado",IF(E27<9.5,"Oral",IF(E27>=9.5,"Aprovado")))) -> Aprovado | G27: x
A28: 145 | B28: Natação | C28: Bruno Duarte Mendes | D28: 0 | E28: =IF(D28=0,"",ROUND(D28,0)) ->  | F28: =IF(E28="","",IF(E28<7.5,"Reprovado",IF(E28<9.5,"Oral",IF(E28>=9.5,"Aprovado")))) -> 
A29: 99/128 | B29: Natação | C29: Valter Silva Tainha | D29: 0 | E29: =IF(D29=0,"",ROUND(D29,0)) ->  | F29: =IF(E29="","",IF(E29<7.5,"Reprovado",IF(E29<9.5,"Oral",IF(E29>=9.5,"Aprovado")))) -> 
A30: 99/78 | B30: Atletismo | C30: José Pedro Pereira Furtado | D30: 0 | E30: =IF(D30=0,"",ROUND(D30,0)) ->  | F30: =IF(E30="","",IF(E30<7.5,"Reprovado",IF(E30<9.5,"Oral",IF(E30>=9.5,"Aprovado")))) -> 
A31: 99/88 | B31: Basquetebol | C31: Manuel António Neto Azevedo | D31: 0 | E31: =IF(D31=0,"",ROUND(D31,0)) ->  | F31: =IF(E31="","",IF(E31<7.5,"Reprovado",IF(E31<9.5,"Oral",IF(E31>=9.5,"Aprovado")))) -> 