A1: Nº | B1: CURSO | C1: NOME | D1: Teste | E1: Nt. Final
A2: 3 | B2: COND.FISICA | C2: Edgar Martins Saraiva | D2: 0 | E2: =IF(D2=0,"",ROUND(D2,0)) ->  | F2: =IF(E2="","",IF(E2<7.5,"Reprovado",IF(E2<9.5,"Oral",IF(E2>=9.5,"Aprovado")))) -> 
A3: 10 | B3: COND.FISICA | C3: Tania Atanasio Bessa | D3: 0 | E3: =IF(D3=0,"",ROUND(D3,0)) ->  | F3: =IF(E3="","",IF(E3<7.5,"Reprovado",IF(E3<9.5,"Oral",IF(E3>=9.5,"Aprovado")))) -> 
A4: 18 | B4: COND.FISICA | C4: Liliana Pereira Silva | D4: 0 | E4: =IF(D4=0,"",ROUND(D4,0)) ->  | F4: =IF(E4="","",IF(E4<7.5,"Reprovado",IF(E4<9.5,"Oral",IF(E4>=9.5,"Aprovado")))) -> 
A5: 24 | B5: COND.FISICA | C5: Nelson Correia Bileu | D5: 0 | E5: =IF(D5=0,"",ROUND(D5,0)) ->  | F5: =IF(E5="","",IF(E5<7.5,"Reprovado",IF(E5<9.5,"Oral",IF(E5>=9.5,"Aprovado")))) -> 
A6: 33 | B6: COND.FISICA | C6: Daniela Latado Bernardo | D6: 12.133333333333335 | E6: =IF(D6=0,"",ROUND(D6,0)) -> 12 | F6: =IF(E6="","",IF(E6<7.5,"Reprovado",IF(E6<9.5,"Oral",IF(E6>=9.5,"Aprovado")))) -> Aprovado
A7: 36 | B7: COND.FISICA | C7: Francisco Ascenso Campos | D7: 0 | E7: =IF(D7=0,"",ROUND(D7,0)) ->  | F7: =IF(E7="","",IF(E7<7.5,"Reprovado",IF(E7<9.5,"Oral",IF(E7>=9.5,"Aprovado")))) -> 
A8: 39 | B8: COND.FISICA | C8: Carlos Manuel Antunes Graça | D8: 10.433 | E8: =IF(D8=0,"",ROUND(D8,0)) -> 10 | F8: =IF(E8="","",IF(E8<7.5,"Reprovado",IF(E8<9.5,"Oral",IF(E8>=9.5,"Aprovado")))) -> Aprovado
A9: 56 | B9: COND.FISICA | C9: Maria João Lemos Barbosa | D9: 0 | E9: =IF(D9=0,"",ROUND(D9,0)) ->  | F9: =IF(E9="","",IF(E9<7.5,"Reprovado",IF(E9<9.5,"Oral",IF(E9>=9.5,"Aprovado")))) -> 
A10: 61 | B10: COND.FISICA | C10: Mónica Felgueiras Salé | D10: 0 | E10: =IF(D10=0,"",ROUND(D10,0)) ->  | F10: =IF(E10="","",IF(E10<7.5,"Reprovado",IF(E10<9.5,"Oral",IF(E10>=9.5,"Aprovado")))) -> 
A11: 78 | B11: COND.FISICA | C11: Dora Nunes Martinho | D11: 7.833333333333333 | E11: =IF(D11=0,"",ROUND(D11,0)) -> 8 | F11: =IF(E11="","",IF(E11<7.5,"Reprovado",IF(E11<9.5,"Oral",IF(E11>=9.5,"Aprovado")))) -> Oral
A12: 87 | B12: COND.FISICA | C12: Vania Teixeira Silva | D12: 6.75 | E12: =IF(D12=0,"",ROUND(D12,0)) -> 7 | F12: =IF(E12="","",IF(E12<7.5,"Reprovado",IF(E12<9.5,"Oral",IF(E12>=9.5,"Aprovado")))) -> Reprovado
A13: 93 | B13: COND.FISICA | C13: Dino Duarte Casimiro | D13: 0 | E13: =IF(D13=0,"",ROUND(D13,0)) ->  | F13: =IF(E13="","",IF(E13<7.5,"Reprovado",IF(E13<9.5,"Oral",IF(E13>=9.5,"Aprovado")))) -> 
A14: 95 | B14: COND.FISICA | C14: Ticiana Barros Gonçalves | D14: 4.2333333333333334 | E14: =IF(D14=0,"",ROUND(D14,0)) -> 4 | F14: =IF(E14="","",IF(E14<7.5,"Reprovado",IF(E14<9.5,"Oral",IF(E14>=9.5,"Aprovado")))) -> Reprovado
A15: 99 | B15: COND.FISICA | C15: João Caetano Paulo | D15: 6.8285714285714283 | E15: =IF(D15=0,"",ROUND(D15,0)) -> 7 | F15: =IF(E15="","",IF(E15<7.5,"Reprovado",IF(E15<9.5,"Oral",IF(E15>=9.5,"Aprovado")))) -> Reprovado
A16: 105 | B16: COND.FISICA | C16: Ana Luisa Vieira Pedro | D16: 9.5871428571428581 | E16: =IF(D16=0,"",ROUND(D16,0)) -> 10 | F16: =IF(E16="","",IF(E16<7.5,"Reprovado",IF(E16<9.5,"Oral",IF(E16>=9.5,"Aprovado")))) -> Aprovado
A17: 115 | B17: COND.FISICA | C17: Bodgan Dobre | D17: 0 | E17: =IF(D17=0,"",ROUND(D17,0)) ->  | F17: =IF(E17="","",IF(E17<7.5,"Reprovado",IF(E17<9.5,"Oral",IF(E17>=9.5,"Aprovado")))) -> 
A18: 119 | B18: COND.FISICA | C18: Carla Sofia Luz Oliveira | D18: 0 | E18: =IF(D18=0,"",ROUND(D18,0)) ->  | F18: =IF(E18="","",IF(E18<7.5,"Reprovado",IF(E18<9.5,"Oral",IF(E18>=9.5,"Aprovado")))) -> 
A19: 133 | B19: COND.FISICA | C19: Ana Luisa Alves Cardoso | D19: 9.5085714285714289 | E19: =IF(D19=0,"",ROUND(D19,0)) -> 10 | F19: =IF(E19="","",IF(E19<7.5,"Reprovado",IF(E19<9.5,"Oral",IF(E19>=9.5,"Aprovado")))) -> Aprovado
A20: 136 | B20: COND.FISICA | C20: Rui Manuel Silva Matias | D20: 0 | E20: =IF(D20=0,"",ROUND(D20,0)) ->  | F20: =IF(E20="","",IF(E20<7.5,"Reprovado",IF(E20<9.5,"Oral",IF(E20>=9.5,"Aprovado")))) -> 
A21: 99/127 | B21: COND.FISICA | C21: Sergio Miguel Nunes Lajas | D21: 0 | E21: =IF(D21=0,"",ROUND(D21,0)) ->  | F21: =IF(E21="","",IF(E21<7.5,"Reprovado",IF(E21<9.5,"Oral",IF(E21>=9.5,"Aprovado")))) -> 
A22: 99/25 | B22: COND.FISICA | C22: Patricia Almeida Vicente | D22: 0 | E22: =IF(D22=0,"",ROUND(D22,0)) ->  | F22: =IF(E22="","",IF(E22<7.5,"Reprovado",IF(E22<9.5,"Oral",IF(E22>=9.5,"Aprovado")))) -> 
A23: 99/4 | B23: COND.FISICA | C23: Anabela Monteiro Alves | D23: 0 | E23: =IF(D23=0,"",ROUND(D23,0)) ->  | F23: =IF(E23="","",IF(E23<7.5,"Reprovado",IF(E23<9.5,"Oral",IF(E23>=9.5,"Aprovado")))) -> 
A24: 99/45 | B24: COND.FISICA | C24: Patricia Moutinho Silva | D24: 0 | E24: =IF(D24=0,"",ROUND(D24,0)) ->  | F24: =IF(E24="","",IF(E24<7.5,"Reprovado",IF(E24<9.5,"Oral",IF(E24>=9.5,"Aprovado")))) -> 