A1: Turma 1
A2: Nº | B2: CURSO | C2: NOME | D2: Teste | E2: Trab. | F2: Nt. Final
A3: 63 | B3: Natação | C3: Alberto Filipe Santos Guedes
A4: 6 | B4: Natação | C4: Alda Paula Melro Leandro
A5: 123 | B5: Natação | C5: Alexandra Silva Coelho | D5: 13.75 | E5: 14 | F5: =ROUND(D5*0.7+E5*0.3,0) -> 14 | G5: Aprovado
A6: 22 | B6: Natação | C6: Ana Isabel Trindade Nogueira | D6: 12 | E6: 9 | F6: =ROUND(D6*0.7+E6*0.3,0) -> 11 | G6: Aprovado
A7: 77 | B7: Basquetebol | C7: Ana Margarida Arroios Faria | D7: 13.08 | E7: 10 | F7: =ROUND(D7*0.7+E7*0.3,0) -> 12 | G7: Aprovado
A8: 34 | B8: Natação | C8: Ana Teresa Conceição | D8: 7.71 | E8: 13 | F8: =ROUND(D8*0.7+E8*0.3,0) -> 9 | G8: Exame
A9: 14 | B9: Natação | C9: Andreia Faria Ferreira | D9: 11.75 | E9: 13 | F9: =ROUND(D9*0.7+E9*0.3,0) -> 12 | G9: Aprovado
A10: 48 | B10: Basquetebol | C10: António Batista Francisco
A11: 145 | B11: Natação | C11: Bruno Duarte Mendes | D11: 13.16 | E11: 14 | F11: =ROUND(D11*0.7+E11*0.3,0) -> 13 | G11: Aprovado
A12: 83 | B12: Natação | C12: Carla Monteiro Rodrigues | D12: 9.83 | E12: 13 | F12: =ROUND(D12*0.7+E12*0.3,0) -> 11 | G12: Aprovado
A13: 5 | B13: Basquetebol | C13: Catarina Sarmento Mendes
A14: 50 | B14: Ginastica | C14: Cecilia Gonçalves Simão | D14: 9.25 | E14: 0 | F14: =ROUND(D14*0.7+E14*0.3,0) -> 6 | G14: Exame
A15: 71 | B15: Ginástica | C15: Elsa Carina Silva Freitas | D15: 11.65 | E15: 11 | F15: =ROUND(D15*0.7+E15*0.3,0) -> 11 | G15: Aprovado
A16: 26 | B16: Natação | C16: Filipa Alexandra Coelho | D16: 10.33 | E16: 11.41888427734375 | F16: =ROUND(D16*0.7+E16*0.3,0) -> 11 | G16: Aprovado
A17: 116 | B17: Natação | C17: Filomena Natividade Silva | D17: 8.16 | E17: 12 | F17: =ROUND(D17*0.7+E17*0.3,0) -> 9 | G17: Exame
A18: 113 | B18: Ginastica | C18: Hugo Oliveira Laranjeira | D18: 11.125 | E18: 11 | F18: =ROUND(D18*0.7+E18*0.3,0) -> 11 | G18: Aprovado
A19: 52 | B19: Ginastica | C19: Joana Macedo Oliveira | D19: 6.6 | E19: 14 | F19: =ROUND(D19*0.7+E19*0.3,0) -> 9 | G19: Exame
A20: 69 | B20: Natação | C20: João Paulo Lopes Osorio
A21: 114 | B21: Natação | C21: João Pedro Ferreira Mendes | D21: 13.74 | E21: 13 | F21: =ROUND(D21*0.7+E21*0.3,0) -> 14 | G21: Aprovado
A22: 99/78 | B22: Atletismo | C22: José Pedro Pereira Furtado
A23: 99/88 | B23: Basquetebol | C23: Manuel António Neto Azevedo
A24: 47 | B24: Atletismo | C24: Marciano António Graça | D24: 13.75 | E24: 17 | F24: =ROUND(D24*0.7+E24*0.3,0) -> 15 | G24: Aprovado
A25: 79 | B25: Natação | C25: Miguel Meireles Silva | D25: 10.46 | E25: 13 | F25: =ROUND(D25*0.7+E25*0.3,0) -> 11 | G25: Aprovado
A26: 132 | B26: Basquetebol | C26: Nuno Miguel Almeida Mendonça | D26: 16.08 | E26: 10 | F26: =ROUND(D26*0.7+E26*0.3,0) -> 14 | G26: Aprovado
A27: 86 | B27: Natação | C27: Nuno Miguel Antunes Santos | D27: 14.83 | E27: 14 | F27: =ROUND(D27*0.7+E27*0.3,0) -> 15 | G27: Aprovado
A28: 110 | B28: Natação | C28: Pedro Manuel Cruz Bento | D28: 9.41 | E28: 14 | F28: =ROUND(D28*0.7+E28*0.3,0) -> 11 | G28: Aprovado
A29: 125 | B29: Natação | C29: Pedro Rodrigues Oliveira | D29: 15.5 | E29: 10 | F29: =ROUND(D29*0.7+E29*0.3,0) -> 14 | G29: Aprovado
A30: 137 | B30: Andebol | C30: Rui Pedro Marques Antunes | D30: 8.55 | E30: 10 | F30: =ROUND(D30*0.7+E30*0.3,0) -> 9 | G30: Exame
A31: 99/128 | B31: Natação | C31: Valter Silva Tainha