A1: Turma 2
A2: Num. | B2: Curso | C2: Nome | D2: Teste | E2: Trab. | F2: Nt. Final
A3: 112 | B3: FUTEBOL | C3: Amaro Oliveira Ferreira | D3: 7.66 | E3: 10 | F3: =ROUND(D3*0.7+E3*0.3,0) -> 8 | G3: Exame
A4: 66 | B4: FUTEBOL | C4: André Fonseca Sousa | D4: 11.66 | E4: 6 | F4: =ROUND(D4*0.7+E4*0.3,0) -> 10 | G4: Exame
A5: 98 | B5: FUTEBOL | C5: António Miguel Gomes Romão | D5: 16.5 | E5: 13 | F5: =ROUND(D5*0.7+E5*0.3,0) -> 15 | G5: Aprovado
A6: 99/101 | B6: FUTEBOL | C6: Artur Daniel Machado Silva
A7: 81 | B7: FUTEBOL | C7: Bruno Duarte Carmo
A8: 144 | B8: FUTEBOL | C8: Bruno Filipe Vieira Oliveira | D8: 6.25 | E8: 12 | F8: =ROUND(D8*0.7+E8*0.3,0) -> 8 | G8: Exame
A9: 103 | B9: FUTEBOL | C9: Bruno Miguel Serafim Costa | D9: 7.08 | E9: 11 | F9: =ROUND(D9*0.7+E9*0.3,0) -> 8 | G9: Exame
A10: 80 | B10: FUTEBOL | C10: Claudia Silva Esteves
A11: 99/106 | B11: FUTEBOL | C11: Delfim Malainho Fernandes
A12: 13 | B12: FUTEBOL | C12: Diogo Correia Bartolo | D12: 6 | E12: 0 | F12: =ROUND(D12*0.7+E12*0.3,0) -> 4 | G12: Exame
A13: 20 | B13: FUTEBOL | C13: Diogo Martins Cruz António | D13: 5 | E13: 13 | F13: =ROUND(D13*0.7+E13*0.3,0) -> 7 | G13: Exame
A14: 40 | B14: FUTEBOL | C14: Eduardo Magalhães Teixeira | D14: 11.34 | E14: 10 | F14: =ROUND(D14*0.7+E14*0.3,0) -> 11 | G14: Aprovado
A15: 7 | B15: FUTEBOL | C15: Fernando Bernardo Tavares | D15: 12.66 | E15: 15 | F15: =ROUND(D15*0.7+E15*0.3,0) -> 13 | G15: Aprovado
A16: 101 | B16: FUTEBOL | C16: Filipe Valente Morais | D16: 12.5 | E16: 13 | F16: =ROUND(D16*0.7+E16*0.3,0) -> 13 | G16: Aprovado
A17: 128 | B17: FUTEBOL | C17: Francisco Simões Andrade | D17: 6.91 | E17: 10 | F17: =ROUND(D17*0.7+E17*0.3,0) -> 8 | G17: Exame
A18: 88 | B18: FUTEBOL | C18: Helder Formas Tavares
A19: 127 | B19: FUTEBOL | C19: Hugo Ramos Pinheiro | D19: 12.07 | E19: 12 | F19: =ROUND(D19*0.7+E19*0.3,0) -> 12 | G19: Aprovado
A20: 58 | B20: FUTEBOL | C20: João Carlos Valado Tralhão | D20: 11.21 | E20: 10 | F20: =ROUND(D20*0.7+E20*0.3,0) -> 11 | G20: Aprovado
A21: 140 | B21: FUTEBOL | C21: João José Barcelos Castro | D21: 10.99 | E21: 13 | F21: =ROUND(D21*0.7+E21*0.3,0) -> 12 | G21: Aprovado
A22: 17 | B22: FUTEBOL | C22: João José Gavancha Carrilho
A23: 118 | B23: FUTEBOL | C23: João Morais Pereira Coelho
A24: 129 | B24: FUTEBOL | C24: João Pedro Salgado Silva | D24: 9.25 | E24: 6 | F24: =ROUND(D24*0.7+E24*0.3,0) -> 8 | G24: Exame
A25: 98/41 | B25: FUTEBOL | C25: José Simões Gouveia
A26: 84 | B26: FUTEBOL | C26: Luis Filipe Saraiva Coelho | D26: 10.35 | E26: 9 | F26: =ROUND(D26*0.7+E26*0.3,0) -> 10 | G26: Aprovado
A27: 11 | B27: FUTEBOL | C27: Miguel Santos Marques | D27: 14.5 | E27: 15 | F27: =ROUND(D27*0.7+E27*0.3,0) -> 15 | G27: Aprovado
A28: 142 | B28: FUTEBOL | C28: Nelson Cabrita Antunes | D28: 13.8 | E28: 13 | F28: =ROUND(D28*0.7+E28*0.3,0) -> 14 | G28: Aprovado
A29: 8 | B29: FUTEBOL | C29: Nuno Custodio Bernardo | D29: 16.33 | E29: 9 | F29: =ROUND(D29*0.7+E29*0.3,0) -> 14 | G29: Aprovado
A30: 54 | B30: FUTEBOL | C30: Nuno Justino Pereira | D30: 14.08 | E30: 11 | F30: =ROUND(D30*0.7+E30*0.3,0) -> 13 | G30: Aprovado
A31: 23 | B31: FUTEBOL | C31: Nuno Miguel Vieira Domingos | D31: 10.5 | E31: 12 | F31: =ROUND(D31*0.7+E31*0.3,0) -> 11 | G31: Aprovado
A32: 65 | B32: FUTEBOL | C32: Paulo Jorge Pires Silva | D32: 7.75 | E32: 11 | F32: =ROUND(D32*0.7+E32*0.3,0) -> 9 | G32: Exame
A33: 99/59 | B33: FUTEBOL | C33: Paulo Silva Carolino
A34: 29 | B34: FUTEBOL | C34: Renato Godinho Ribeiro | D34: 7.25 | E34: 11 | F34: =ROUND(D34*0.7+E34*0.3,0) -> 8 | G34: Exame
A35: 98/24 | B35: FUTEBOL | C35: Ricardo Neves Silva
A36: 59 | B36: FUTEBOL | C36: Rolando Mendes Carrasco | D36: 12.85 | E36: 6 | F36: =ROUND(D36*0.7+E36*0.3,0) -> 11 | G36: Exame
A37: 15 | B37: FUTEBOL | C37: Romão Azevedo Ferreira | D37: 6.75 | E37: 10 | F37: =ROUND(D37*0.7+E37*0.3,0) -> 8 | G37: Exame
A38: 73 | B38: FUTEBOL | C38: Rui Jorge Castanheira Castro
A39: 99/132 | B39: FUTEBOL | C39: Vitor Manuel Pereira Afonso