A1: Turma 3
A2: Nº | B2: CURSO | C2: NOME | D2: Teste | E2: Trab. | F2: Nt. Final
A3: 55 | B3: COND.FISICA | C3: Ana Isabel Machado Cardoso | D3: 14.57 | E3: 0 | F3: =ROUND(D3*0.7+E3*0.3,0) -> 10 | G3: Exame
A4: 2 | B4: COND.FISICA | C4: Ana Sofia Oliveira Dias | D4: 12.49 | E4: 13 | F4: =ROUND(D4*0.7+E4*0.3,0) -> 13 | G4: Aprovado
A5: 64 | B5: COND.FISICA | C5: Andrea Soares Gonçalves | D5: 10.65 | E5: 11 | F5: =ROUND(D5*0.7+E5*0.3,0) -> 11 | G5: Aprovado
A6: 19 | B6: COND.FISICA | C6: António Domingos Coelho | D6: 9.5 | E6: 0 | F6: =ROUND(D6*0.7+E6*0.3,0) -> 7 | G6: Exame
A7: 122 | B7: COND.FISICA | C7: Carlos Rodrigues Matos | D7: 6.24 | E7: 12 | F7: =ROUND(D7*0.7+E7*0.3,0) -> 8 | G7: Exame
A8: 141 | B8: COND.FISICA | C8: Eduardo Jorge Caetano Sousa
A9: 135 | B9: COND.FISICA | C9: Gonçalo Chorão Beirão | D9: 13.33 | E9: 11 | F9: =ROUND(D9*0.7+E9*0.3,0) -> 13 | G9: Aprovado
A10: 90 | B10: COND.FISICA | C10: Isabel Moita Ferreira | D10: 16.25 | E10: 0 | F10: =ROUND(D10*0.7+E10*0.3,0) -> 11 | G10: Exame
A11: 107 | B11: COND.FISICA | C11: Joana Rita Martins Azul | D11: 13.11 | E11: 14 | F11: =ROUND(D11*0.7+E11*0.3,0) -> 13 | G11: Aprovado
A12: 111 | B12: COND.FISICA | C12: João Filipe Borges Fernandes
A13: 98/18 | B13: COND.FISICA | C13: Luis Miguel Courinha Rosa
A14: 76 | B14: COND.FISICA | C14: Marisa Carvalho Gomes | D14: 13.75 | E14: 13 | F14: =ROUND(D14*0.7+E14*0.3,0) -> 14 | G14: Aprovado
A15: 117 | B15: COND.FISICA | C15: Maura Simões Alves | D15: 9.83 | E15: 13 | F15: =ROUND(D15*0.7+E15*0.3,0) -> 11 | G15: Aprovado
A16: 9 | B16: COND.FISICA | C16: Mauro José Nobre Costa | D16: 12.58 | E16: 9 | F16: =ROUND(D16*0.7+E16*0.3,0) -> 12 | G16: Aprovado
A17: 96 | B17: COND.FISICA | C17: Mónica Isabel Alves Santos | D17: 11.5 | E17: 11 | F17: =ROUND(D17*0.7+E17*0.3,0) -> 11 | G17: Aprovado
A18: 82 | B18: COND.FISICA | C18: Mónica Martins Fernandes | D18: 11.25 | E18: 13 | F18: =ROUND(D18*0.7+E18*0.3,0) -> 12 | G18: Aprovado
A19: 4 | B19: COND.FISICA | C19: Patricia Botas Faustino | D19: 7.24 | E19: 10 | F19: =ROUND(D19*0.7+E19*0.3,0) -> 8 | G19: Exame
A20: 99/73 | B20: COND.FISICA | C20: Paulo Granado Seixal
A21: 49 | B21: COND.FISICA | C21: Paulo Miguel Santos Dias | D21: 10.88 | E21: 15 | F21: =ROUND(D21*0.7+E21*0.3,0) -> 12 | G21: Aprovado
A22: 45 | B22: COND.FISICA | C22: Pedro Graça Carriço | D22: 10.66 | E22: 11 | F22: =ROUND(D22*0.7+E22*0.3,0) -> 11 | G22: Aprovado
A23: 99/126 | B23: COND.FISICA | C23: Pedro Nuno Tedim Campos
A24: 38 | B24: COND.FISICA | C24: Ricardo Melo Santos | D24: 12.06 | E24: 11 | F24: =ROUND(D24*0.7+E24*0.3,0) -> 12 | G24: Aprovado
A25: 109 | B25: COND.FISICA | C25: Sandra Nunes Martins | D25: 12.65 | E25: 13 | F25: =ROUND(D25*0.7+E25*0.3,0) -> 13 | G25: Aprovado
A26: 28 | B26: COND.FISICA | C26: Sónia Maria Silva Pinho | D26: 12.32 | E26: 5 | F26: =ROUND(D26*0.7+E26*0.3,0) -> 10 | G26: Exame
A27: 99/135 | B27: COND.FISICA | C27: Susana Queirós Barbosa | D27: 13.99 | E27: 14 | F27: =ROUND(D27*0.7+E27*0.3,0) -> 14 | G27: Aprovado
A28: 94 | B28: COND.FISICA | C28: Teresa Sofia Amorim Mendes | D28: 9.09 | E28: 5 | F28: =ROUND(D28*0.7+E28*0.3,0) -> 8 | G28: Exame
A29: 32 | B29: COND.FISICA | C29: Vitor Hugo Garcia Luis | D29: 12.58 | E29: 15 | F29: =ROUND(D29*0.7+E29*0.3,0) -> 13 | G29: Aprovado