A1: Turma 4
A2: Nº | B2: CURSO | C2: NOME | D2: Teste | E2: Trabalho | F2: Nt. Final
A3: 133 | B3: COND.FISICA | C3: Ana Luisa Alves Cardoso | D3: 8.83 | E3: 7 | F3: =ROUND(D3*0.7+E3*0.3,0) -> 8 | G3: Exame
A4: 105 | B4: COND.FISICA | C4: Ana Luisa Vieira Pedro | D4: 9.63 | E4: 9 | F4: =ROUND(D4*0.7+E4*0.3,0) -> 9 | G4: Exame
A5: 99/4 | B5: COND.FISICA | C5: Anabela Monteiro Alves
A6: 115 | B6: COND.FISICA | C6: Bodgan Dobre | D6: 12.41 | E6: 9 | F6: =ROUND(D6*0.7+E6*0.3,0) -> 11 | G6: Aprovado
A7: 119 | B7: COND.FISICA | C7: Carla Sofia Luz Oliveira | D7: 11.08 | E7: 12 | F7: =ROUND(D7*0.7+E7*0.3,0) -> 11 | G7: Aprovado
A8: 39 | B8: COND.FISICA | C8: Carlos Manuel Antunes Graça | D8: 4.43 | E8: 5 | F8: =ROUND(D8*0.7+E8*0.3,0) -> 5 | G8: Exame
A9: 33 | B9: COND.FISICA | C9: Daniela Latado Bernardo | D9: 8.13 | E9: 9 | F9: =ROUND(D9*0.7+E9*0.3,0) -> 8 | G9: Exame
A10: 93 | B10: COND.FISICA | C10: Dino Duarte Casimiro
A11: 78 | B11: COND.FISICA | C11: Dora Nunes Martinho
A12: 3 | B12: COND.FISICA | C12: Edgar Martins Saraiva | D12: 11.4 | E12: 14.25 | F12: =ROUND(D12*0.7+E12*0.3,0) -> 12 | G12: Aprovado
A13: 36 | B13: COND.FISICA | C13: Francisco Ascenso Campos | D13: 14.49 | E13: 10 | F13: =ROUND(D13*0.7+E13*0.3,0) -> 13 | G13: Aprovado
A14: 99 | B14: COND.FISICA | C14: João Caetano Paulo | D14: 6 | E14: 13 | F14: =ROUND(D14*0.7+E14*0.3,0) -> 8 | G14: Exame
A15: 18 | B15: COND.FISICA | C15: Liliana Pereira Silva | D15: 10.07 | E15: 13 | F15: =ROUND(D15*0.7+E15*0.3,0) -> 11 | G15: Aprovado
A16: 56 | B16: COND.FISICA | C16: Maria João Lemos Barbosa
A17: 61 | B17: COND.FISICA | C17: Mónica Felgueiras Salé | D17: 15.41 | E17: 13 | F17: =ROUND(D17*0.7+E17*0.3,0) -> 15 | G17: Aprovado
A18: 24 | B18: COND.FISICA | C18: Nelson Correia Bileu | D18: 11.16 | E18: 14 | F18: =ROUND(D18*0.7+E18*0.3,0) -> 12 | G18: Aprovado
A19: 99/25 | B19: COND.FISICA | C19: Patricia Almeida Vicente
A20: 99/45 | B20: COND.FISICA | C20: Patricia Moutinho Silva | D20: 9.6 | E20: 12 | F20: =ROUND(D20*0.7+E20*0.3,0) -> 10 | G20: Aprovado
A21: 136 | B21: COND.FISICA | C21: Rui Manuel Silva Matias | D21: 9 | E21: 11 | F21: =ROUND(D21*0.7+E21*0.3,0) -> 10 | G21: Aprovado
A22: 99/127 | B22: COND.FISICA | C22: Sergio Miguel Nunes Lajas
A23: 10 | B23: COND.FISICA | C23: Tania Atanasio Bessa | D23: 8.08 | E23: 13 | F23: =ROUND(D23*0.7+E23*0.3,0) -> 10 | G23: Aprovado
A24: 95 | B24: COND.FISICA | C24: Ticiana Barros Gonçalves | D24: 7.48 | E24: 7 | F24: =ROUND(D24*0.7+E24*0.3,0) -> 7 | G24: Exame
A25: 87 | B25: COND.FISICA | C25: Vania Teixeira Silva | D25: 8 | E25: 5 | F25: =ROUND(D25*0.7+E25*0.3,0) -> 7 | G25: Exame