A1: Turma 5
A2: Nº | B2: CURSO | C2: NOME | D2: Teste | E2: Trabalho | F2: Nt. Final
A3: 120 | B3: ANI.REC.LAZER | C3: Ana Mafalda Pereira Silva
A4: 72 | B4: ANI.REC.LAZER | C4: Claudia Temporão Filipe | D4: 8 | E4: 11 | F4: =ROUND(D4*0.7+E4*0.3,0) -> 9 | G4: Exame
A5: 134 | B5: ANI.REC.LAZER | C5: David Castanheira Galvão | D5: 11.32 | E5: 0 | F5: =ROUND(D5*0.7+E5*0.3,0) -> 8 | G5: Exame
A6: 130 | B6: ANI.REC.LAZER | C6: Gonçalo Paulo Cruz | D6: 15.91 | E6: 13 | F6: =ROUND(D6*0.7+E6*0.3,0) -> 15 | G6: Aprovado
A7: 92 | B7: ANI.REC.LAZER | C7: Gonçalo Pedro Lucas Silva
A8: 108 | B8: ANI.REC.LAZER | C8: Henrique Antunes Hilário | D8: 11.75 | E8: 0 | F8: =ROUND(D8*0.7+E8*0.3,0) -> 8 | G8: Exame
A9: 124 | B9: ANI.REC.LAZER | C9: Hugo Renato Oliveira Silva | D9: 7.82 | E9: 0 | F9: =ROUND(D9*0.7+E9*0.3,0) -> 5 | G9: Exame
A10: 1 | B10: ANI.REC.LAZER | C10: Hugo Saraiva Martins | D10: 11.5 | E10: 10 | F10: =ROUND(D10*0.7+E10*0.3,0) -> 11 | G10: Aprovado
A11: 30 | B11: ANI.REC.LAZER | C11: Isabel Santos Vieira | D11: 9.74 | E11: 0 | F11: =ROUND(D11*0.7+E11*0.3,0) -> 7 | G11: Exame
A12: 100 | B12: ANI.REC.LAZER | C12: João Pedro Marques Duarte | D12: 10.82 | E12: 13 | F12: =ROUND(D12*0.7+E12*0.3,0) -> 11 | G12: Aprovado
A13: 102 | B13: ANI.REC.LAZER | C13: Lucia Cardoso Almeida | D13: 12.53 | E13: 12 | F13: =ROUND(D13*0.7+E13*0.3,0) -> 12 | G13: Aprovado
A14: 99/85 | B14: ANI.REC.LAZER | C14: Luis Filipe Cruz Gomes
A15: 35 | B15: ANI.REC.LAZER | C15: Luis Miguel Rodrigues Lazaro | D15: 12.98 | E15: 14 | F15: =ROUND(D15*0.7+E15*0.3,0) -> 13 | G15: Aprovado
A16: 104 | B16: ANI.REC.LAZER | C16: Marcia Aleixo Vilela | D16: 10.16 | E16: 12 | F16: =ROUND(D16*0.7+E16*0.3,0) -> 11 | G16: Aprovado
A17: 67 | B17: ANI.REC.LAZER | C17: Mário Dinis Mendes Silva | D17: 8.52 | E17: 0 | F17: =ROUND(D17*0.7+E17*0.3,0) -> 6 | G17: Exame
A18: 139 | B18: ANI.REC.LAZER | C18: Nuno João Marques Araujo | D18: 6.25 | E18: 0 | F18: =ROUND(D18*0.7+E18*0.3,0) -> 4 | G18: Exame
A19: 27 | B19: ANI.REC.LAZER | C19: Nuno Martins Narciso | D19: 14.25 | E19: 13 | F19: =ROUND(D19*0.7+E19*0.3,0) -> 14 | G19: Aprovado
A20: 53 | B20: ANI.REC.LAZER | C20: Nuno Miguel Matos Costa | D20: 12.57 | E20: 14 | F20: =ROUND(D20*0.7+E20*0.3,0) -> 13 | G20: Aprovado
A21: 75 | B21: ANI.REC.LAZER | C21: Paulo Jorge Moniz Pacheco | D21: 9.49 | E21: 13 | F21: =ROUND(D21*0.7+E21*0.3,0) -> 11 | G21: Aprovado
A22: 89 | B22: ANI.REC.LAZER | C22: Pedro Lopes Castanheira
A23: 21 | B23: ANI.REC.LAZER | C23: Rui Pedro Silva Pereira | D23: 5.83 | E23: 14 | F23: =ROUND(D23*0.7+E23*0.3,0) -> 8 | G23: Exame
A24: 138 | B24: ANI.REC.LAZER | C24: Silvia Marques Araujo | D24: 11.14 | E24: 0 | F24: =ROUND(D24*0.7+E24*0.3,0) -> 8 | G24: Exame
A25: 46 | B25: ANI.REC.LAZER | C25: Silvia Rodrigues Areia | D25: 7.23 | E25: 11 | F25: =ROUND(D25*0.7+E25*0.3,0) -> 8 | G25: Exame
A26: 146 | B26: ANI.REC.LAZER | C26: Sónia Pereira Carvalho
A27: 12 | B27: ANI.REC.LAZER | C27: Vasco Miguel Silva Oliveira | D27: 8.48 | E27: 12 | F27: =ROUND(D27*0.7+E27*0.3,0) -> 10 | G27: Aprovado