A1: Turma 6
A2: Nº | B2: CURSO | C2: NOME | D2: Teste | E2: Trab. | F2: Nt. Final
A3: 60 | B3: ANI.REC.LAZER | C3: Abel Jorge Santos Lopes | D3: 5.75 | E3: 9 | F3: =ROUND(D3*0.7+E3*0.3,0) -> 7 | G3: Exame
A4: 43 | B4: ANI.REC.LAZER | C4: Bruno Candido Baptista | D4: 14.49 | E4: 13 | F4: =ROUND(D4*0.7+E4*0.3,0) -> 14 | G4: Aprovado
A5: 41 | B5: ANI.REC.LAZER | C5: Candido Pedro Mota Paris | D5: 8 | E5: 13 | F5: =ROUND(D5*0.7+E5*0.3,0) -> 10 | G5: Aprovado
A6: 25 | B6: ANI.REC.LAZER | C6: Carlos Conceição Batista | D6: 12.55 | E6: 13 | F6: =ROUND(D6*0.7+E6*0.3,0) -> 13 | G6: Aprovado
A7: 70 | B7: ANI.REC.LAZER | C7: Catarina Nobre Sousa Canha
A8: 42 | B8: ANI.REC.LAZER | C8: César Vitorino Oliveira | D8: 4.33 | E8: 13 | F8: =ROUND(D8*0.7+E8*0.3,0) -> 7 | G8: Exame
A9: 106 | B9: ANI.REC.LAZER | C9: Daniel João Santos Louro | D9: 10.79 | E9: 0 | F9: =ROUND(D9*0.7+E9*0.3,0) -> 8 | G9: Exame
A10: 85 | B10: ANI.REC.LAZER | C10: Fernando Jacinto Ferreira | D10: 7.24 | E10: 14 | F10: =ROUND(D10*0.7+E10*0.3,0) -> 9 | G10: Exame
A11: 97 | B11: ANI.REC.LAZER | C11: Filipe Dâmaso Nunes Gomes | D11: 5.1 | E11: 13 | F11: =ROUND(D11*0.7+E11*0.3,0) -> 7 | G11: Exame
A12: 126 | B12: ANI.REC.LAZER | C12: Frederico Silva Tiago | D12: 10.51 | E12: 9 | F12: =ROUND(D12*0.7+E12*0.3,0) -> 10 | G12: Aprovado
A13: 99/114 | B13: ANI.REC.LAZER | C13: Gonçalo Simões Azevedo
A14: 143 | B14: ANI.REC.LAZER | C14: João Carlos Pereira Girão | D14: 9.91 | E14: 0 | F14: =ROUND(D14*0.7+E14*0.3,0) -> 7 | G14: Exame
A15: 131 | B15: ANI.REC.LAZER | C15: João Miguel Salgado Jesus
A16: 62 | B16: ANI.REC.LAZER | C16: José Gonçalves Abreu
A17: 91 | B17: ANI.REC.LAZER | C17: Mário João Violante Santos | D17: 12.83 | E17: 13 | F17: =ROUND(D17*0.7+E17*0.3,0) -> 13 | G17: Aprovado
A18: 51 | B18: ANI.REC.LAZER | C18: Nuno Pereira Henriques | D18: 16.41 | E18: 13 | F18: =ROUND(D18*0.7+E18*0.3,0) -> 15 | G18: Aprovado
A19: 74 | B19: ANI.REC.LAZER | C19: Pedro Dinis Pereira | D19: 11.63 | E19: 13 | F19: =ROUND(D19*0.7+E19*0.3,0) -> 12 | G19: Aprovado
A20: 16 | B20: ANI.REC.LAZER | C20: Raul Jesus Mota | D20: 10 | E20: 9 | F20: =ROUND(D20*0.7+E20*0.3,0) -> 10 | G20: Aprovado
A21: 37 | B21: ANI.REC.LAZER | C21: Ricardo José Santo Melo | D21: 13.23 | E21: 10 | F21: =ROUND(D21*0.7+E21*0.3,0) -> 12 | G21: Aprovado
A22: 31 | B22: ANI.REC.LAZER | C22: Tiago José Vindima Ferreira | D22: 11.48 | E22: 9 | F22: =ROUND(D22*0.7+E22*0.3,0) -> 11 | G22: Aprovado
A23: 121 | B23: ANI.REC.LAZER | C23: Valter José Dias Vilela | D23: 9.91 | E23: 13 | F23: =ROUND(D23*0.7+E23*0.3,0) -> 11 | G23: Aprovado